question_text,question_image_url,course_name,chapter,Topic,marks,difficulty,option_1,option_1_image_url,option_2,option_2_image_url,option_3,option_3_image_url,option_4,option_4_image_url,answer_option_number
The angular momentum of electron in ground state is L₁ of Hydrogen atom. The angular momentum of electron in ground state of Li⁺⁺ ion become L₂ then,,Physics,Atomic Physics,Bohr Model,1,Medium,L₁ = L₂,,L₁ = 3L₂,,L₂ = 3L₁,,L₂ = 9L₁,,3
In transistor supply voltage is 8V and voltage drop across resistor of 800Ω in collector is 0.5V then base current is if α is 0.96.,,Physics,Electronics,Transistor,1,Hard,24μA,,25μA,,26μA,,27μA,,3
A train accelerate from rest with α for time t₁ and retard at β for time t₂ and comes to rest then t₁/t₂ is,,Physics,Kinematics,Motion in One Dimension,1,Medium,β/α,,α/β,,α²/β²,,β²/α²,,1
question_text,question_image_url,course_name,chapter,Topic,marks,difficulty,option_1,option_1_image_url,option_2,option_2_image_url,option_3,option_3_image_url,option_4,option_4_image_url,answer_option_number
The period of revolution of a satellite in an orbit close to surface of earth is independent of,,Physics,Gravitation,Satellites,1,Easy,mass of planet,,radius of planet,,mass of satellite,,all of above,,4
When an object is immersed in a liquid then object become invisible if,,Physics,Optics,Refraction,1,Medium,it act as reflector,,absorb all light falling on it,,have refractive index 1,,have refractive index equal to that of liquid,,4
There are 5 resistors of 1Ω each. If first three are joined in parallel then remaining is series then equivalent resistance will be,,Physics,Electricity,Resistors,1,Medium,3Ω,,8Ω,,75Ω\frac{7}{5} \Omega,,52Ω\frac{5}{2} \Omega,,4
The threshold frequency of certain metal surface is f₀. If the frequency of incident radiation is 2f₀ then velocity of electron emitted from metal is 4×10⁶ m/s. The velocity of electron emitted if frequency of radiation become 5f₀ is,,Physics,Modern Physics,Photoelectric Effect,1,Hard,8×10⁶ m/s,,2×10⁶ m/s,,8×10⁷ m/s,,2×10⁷ m/s,,4
The solubility of Ferric hydroxide is x mole/litre. The Ksp of the electrolyte is,,Chemistry,Equilibrium,Solubility Product,1,Hard,4x³,,9x⁴,,27x⁴,,108x⁵,,4
Octet rule is violated in case of,,Chemistry,Chemical Bonding,Octet Rule,1,Medium,CO₂,,SO₂,,BeCl₂,,N₂O,,3
The O.N. of nitrogen in ammonium nitrite is,,Chemistry,Redox,Oxidation Number,1,Hard,"=+1, –1",,"–1, +1",,"–3, +3",,"–3, +5",,4
Which of these have highest ionization potential?,,Chemistry,Periodic Table,Periodic Properties,1,Easy,B,,C,,N,,O,,3
Nitrolim is,,Chemistry,Nitrogen Compounds,Fertilizers,1,Medium,Ca(CN)₂,,CaC₂ + N₂,,CaCN₂ + C,,None,,3
SO₂ gas is dehydrated using,,Chemistry,Sulphur Compounds,Properties of SO₂,1,Medium,CaO,,P₂O₅,,CaCl₂,,Conc. H₂SO₄,,2
Which of these metal nitrate gives metal on heating?,,Chemistry,Inorganic Chemistry,Nitrate Reactions,1,Medium,Cu(NO₃)₂,,KNO₃,,AgNO₃,,Zn(NO₃)₂,,3
The reducing agent used for extraction of iron is,,Chemistry,Metallurgy,Reduction,1,Easy,H₂,,Al,,C,,CO,,4
Philosopher's wool is,,Chemistry,Chemistry in Everyday Life,Compounds,1,Easy,ZnCO₃,,ZnO,,ZnSO₄.7H₂O,,Cu₂O,,2
The IUPAC name of Malonic acid is,,Chemistry,Organic Chemistry,Carboxylic Acids,1,Medium,"Ethane-1, 2-dioic acid",,"Butane-1, 2-dioic acid",,"But-2-ene-1, 4-dioic acid",,"Propane-1, 3-dioic acid",,1
Which of these can give metamers?,,Chemistry,Organic Chemistry,Isomerism,1,Medium,Ester,,Ether,,Amine,,All of these,,4
Law of reciprocal proportions is also known as law of,,Chemistry,Stoichiometry,Laws of Chemical Combination,1,Medium,Equivalent masses,,Permanent ratios,,Both (a) and (b),,Multiple proportions,,3
The compressibility of a gas is less than unity at STP. Therefore,,Chemistry,Gaseous State,Ideal Gas Deviations,1,Hard,V_m > 22.4,,V_m < 22.4,,V_m = 22.4,,V_m = 22.4,,2
Which of the following is not a foreign element,,Chemistry,Periodic Classification,Elements,1,Easy,O,,P,,S,,X,,4
question_text,question_image_url,course_name,chapter,Topic,marks,difficulty,option_1,option_1_image_url,option_2,option_2_image_url,option_3,option_3_image_url,option_4,option_4_image_url,answer_option_number
"The number of one to one function from a set A = {a, b, c} to another set B = {1, 2} is",,Mathematics,Sets,Functions,1,Medium,0,,3,,6,,12,,1
Cosec⁻¹x = sin⁻¹(1/x) is true for,,Mathematics,Trigonometry,Inverse Trig Functions,1,Medium,any real number x,,"x ∈ [–1, 1]",,,x,≤ 1,,
The absolute value of determinant of a square matrix is altered if,,Mathematics,Matrices,Properties of Determinants,1,Medium,the matrix is transposed,,two rows of the matrix are interchanged,,a column is subtracted from another column of the matrix,,the matrix is inversed,,3
The roots of a quadratic equation x² + ax + 2 = 0 (a ∈ ℝ) are,,Mathematics,Algebra,Quadratic Equations,1,Medium,real and equal,,real and unequal,,real but opposite in sign,,complex conjugate,,3
Area between a line x + y = a and circle x² + y² = a² is,,Mathematics,Coordinate Geometry,Area Between Curves,1,Hard,12(1−2π)a2\frac{1}{2}(1 - 2\pi)a^2,,14(π−2)a2\frac{1}{4}(\pi - 2)a^2,,12(π−1)a2\frac{1}{2}(\pi - 1)a^2,,12(π−1)a\frac{1}{2}(\pi - 1)a,,3
Which one of the following doesn't represent a conic?,,Mathematics,Conic Sections,General Equations,1,Medium,y² – 8x = 0,,4x² + y² = 12,,xy = 5,,dx² – y² = 0,,4
lim⁡n→∞(nn+1+nn+2+...+nn+n)\lim_{n \to \infty} \left( \frac{n}{n+1} + \frac{n}{n+2} + ... + \frac{n}{n+n} \right),,Mathematics,Limits,Sequence and Series,1,Hard,0,,1,,e,,ln 2,,2
The probability that an ordinary or a non-leap year has 53 Sundays is,,Mathematics,Probability,Calendar Based,1,Medium,27\frac{2}{7},,17\frac{1}{7},,37\frac{3}{7},,16\frac{1}{6},,1
∫0π/4sin⁡xcos⁡2xdx=\int_{0}^{\pi/4} \frac{\sin x}{\cos^2 x} dx =,,Mathematics,Calculus,Integration,1,Medium,2−1\sqrt{2} - 1,,22\frac{\sqrt{2}}{2},,1−21 - \sqrt{2},,12−1\frac{1}{\sqrt{2}} - 1,,1
"If a + b + c = 0, then which one of the following is not true about a̅, b̅ and c̅ ?",,Mathematics,Vectors,Vector Properties,1,Medium,they are coplanar,,they are collinear,,they are linearly dependent,,they are represented by sides of a triangle taken in order,,2
"If A = {x, y}, then the power set of A is",,Mathematics,Sets,Power Set,1,Easy,"{x, y}",,"{x, y, ∅}",,"{∅, {x}, {y}}",,"{∅, {x}, {y}, {x, y}}",,4
The reflection of complex no. z = 2 + 3i about x-axis is,,Mathematics,Complex Numbers,Geometrical Representation,1,Easy,"2, –3i",,2 – 3i,,2 + 3i,,3 + i√13,,2
"The harmonic mean of 4, 8, 16 is",,Mathematics,Statistics,Averages,1,Medium,4.2,,6.4,,6.85,,7.8,,3
The greatest coefficient in the expansion of (1 + x)ⁿ is,,Mathematics,Binomial Theorem,Maximum Term,1,Hard,2Cₙ,,2nCₙ₋₁,,nCₙ,,2nCₙ₋₂,,2
The angle between the bisectors of angles between the lines 2x + y + 3 = 0 and x + 2y + 5 = 0 is,,Mathematics,Coordinate Geometry,Angle Between Lines,1,Hard,0,,π6\frac{\pi}{6},,π2\frac{\pi}{2},,π3\frac{\pi}{3},,2
"If α, β, γ be direction angle of lines, then cos2α + cos2β + cos2γ =",,Mathematics,3D Geometry,Direction Cosines,1,Medium,–1,,–2,,1,,2,,2
question_text,question_image_url,course_name,chapter,Topic,marks,difficulty,option_1,option_1_image_url,option_2,option_2_image_url,option_3,option_3_image_url,option_4,option_4_image_url,answer_option_number
lim⁡x→0ax−bxx\lim_{x \to 0} \frac{a^x - b^x}{x} =,,Mathematics,Limits,Exponential and Logarithmic Limits,1,Medium,log⁡ab\log \frac{a}{b},,a – b,,ea−be^{a - b},,log⁡(ba)\log \left( \frac{b}{a} \right),,1
If ( f(x) =,x - 5,"), then f′(6)f'(6) is",,Mathematics,Differentiation,Modulus Function,1,Medium,0,,1,,–1,,does not exist
∫axdx=\int a^x dx =,,Mathematics,Integration,Standard Integrals,1,Easy,axlog⁡a+c\frac{a^x}{\log a} + c,,axlog⁡3+c3\frac{a^x \log 3 + c}{3},,ax3log⁡a+c\frac{a^x}{3\log a} + c,,axlog⁡3+c\frac{a^x}{\log 3} + c,,1
The maximum value of f(x)=asin⁡x+bcos⁡xf(x) = a \sin x + b \cos x is,,Mathematics,Trigonometry,Maximum Value,1,Easy,ab,,a + b,,a2+b2\sqrt{a^2 + b^2},,a² + b²,,3
"The word ""communication"" is stressed on the ... syllable.",,English,Grammar,Stress and Intonation,1,Easy,first,,second,,third,,fourth,,4
How many different phonemes does the word “mathematics” contain?,,English,Phonetics,Phonemes,1,Medium,seven,,eight,,nine,,ten,,3
How long ... each other?,,English,Grammar,Sentence Completion,1,Easy,have you been known,,do you know,,did you known,,have you known,,4
Which is acceptable? Neither of them has done ... duty.,,English,Grammar,Usage,1,Easy,our,,her,,their,,their,,3
"The indirect of ""I said, 'Are you married, madam?'""",,English,Grammar,Reported Speech,1,Medium,I addressed her as madam and asked her if she was married.,,I asked if she was married.,,I asked madam if she was married.,,I said whether she was married.,,1
She can't part ... her jewels.,,English,Prepositions,Usage,1,Easy,with,,from,,to,,for,,1
Which is complex sentence?,,English,Sentence Types,Complex Sentences,1,Medium,If you work hard you would get success.,,Work hard and you will get success.,,After working hard you will get success.,,Having work hard you will get success.,,3
Nobody could see through the design of the fellow. This means ...,,English,Vocabulary,Idioms,1,Medium,beware of the trick,,know the antecedents,,learn the aim,,understand the process,,1
Which of the following is accepted?,,English,Grammar,Sentence Correction,1,Medium,The boy was watching him running up the steps.,,The boy was watched running up the steps.,,The boy was watched to run up the steps.,,The boy was watched being run up the steps by me.,,1
Each of the examples ... good.,,English,Grammar,Subject-Verb Agreement,1,Easy,were,,am,,have,,was,,4
He was victim ... hopes and fears.,,English,Prepositions,Usage,1,Medium,to,,from,,of,,by,,3
Travel will ... you with new costumes.,,English,Vocabulary,Verb Usage,1,Medium,expose,,acquaint,,associate,,comply,,2
question_text,question_image_url,course_name,chapter,Topic,marks,difficulty,option_1,option_1_image_url,option_2,option_2_image_url,option_3,option_3_image_url,option_4,option_4_image_url,answer_option_number
When ceiling fan is switched off then angular velocity falls to half after 36 revolution. The no. of further revolution made before coming to rest is,,Physics,Rotational Motion,Angular Deceleration,2,Medium,36,,24,,18,,12,,3
A particle is in SHM of time period 2 seconds. The time in which it travel from mean position to half of amplitude is,,Physics,SHM,Time in SHM,2,Medium,12\frac{1}{2} sec,,13\frac{1}{3} sec,,14\frac{1}{4} sec,,16\frac{1}{6} sec,,4
A cubical box of wood of side 30cm weighing 21.6kg floats in water. The depth of immersed portion is,,Physics,Fluids,Buoyancy,2,Hard,2.5 cm,,12 cm,,6 cm,,24 cm,,2
100g of ice at 0°C is mixed with 100g of water at 100°C then temperature of mixture will be,,Physics,Thermodynamics,Calorimetry,2,Easy,10°C,,20°C,,30°C,,40°C,,3
A sonometer resonate with fork with 5 antinode for a load of 9kg. This mass is replaced by another mass M then string resonate with same fork forming 3 antinodes. The value of M is,,Physics,Waves,Resonance,2,Medium,25 kg,,5 kg,,12.5 kg,,50 kg,,4
A thin equiconvex lens has focal length 10cm and refractive index 1.5. One of its face is silvered then for an object placed at 'u' infront it coincide with its image. The value of u is,,Physics,Optics,Silvered Lens,2,Hard,10 cm,,5 cm,,20 cm,,15 cm,,3
A parallel beam of light of wavelength 6000Å is incident normally on a slit of width 0.2mm. The diffraction patterns are observed on screen which is at focal plane of convex lens of focal length 50cm. The distance between minima on both sides of central maxima is,,Physics,Wave Optics,Diffraction,2,Hard,1 mm,,2 mm,,3 mm,,4 mm,,2
A charged spherical conductor of radius 10cm has potential 60V at 5cm from centre. The potential at 15cm from centre is,,Physics,Electrostatics,Potential,2,Medium,20 V,,40 V,,60 V,,90 V,,1
The no. of cells of emf 2.1V & internal resistance 2Ω are needed in series so that 1.5A current flows through a resistor of 6Ω is,,Physics,Current Electricity,Series Circuit,2,Medium,4,,5,,6,,7,,3
An electric kettle has two heating coils. When one of the coil is connected with a source then water in kettle boils in 10 minutes. If another coil is connected then same amount of water boils in 5 min which same water boils. If both coils are connected in parallel?,,Physics,Heat,Heating Effect,2,Medium,4 min,,5 min,,6 min,,8 min,,1
An inductive coil has a resistance 100Ω when ac signal of 1000Hz is fed to coil then voltage lead current by 45°. The inductance of coil is,,Physics,AC Circuit,Inductive Circuit,2,Hard,4 mH,,8 mH,,12 mH,,16 mH,,2
Half life of radioactive source is 20 minutes. The time between 20% and 80% decay is,,Physics,Nuclear Physics,Radioactive Decay,2,Medium,25 min,,30 min,,40 min,,80 min,,3
The wavelength of radiation emitted is λ₀ when an electron jump from third orbit to second orbit of hydrogen atom. The wavelength of radiation emitted when electron jump from 4th orbit to 2nd orbit will be,,Physics,Modern Physics,Hydrogen Spectrum,2,Hard,1625λ0\frac{16}{25} \lambda_0,,2027λ0\frac{20}{27} \lambda_0,,2720λ0\frac{27}{20} \lambda_0,,16λ0\frac{16}{\lambda_0},,2
question_text,question_image_url,course_name,chapter,Topic,marks,difficulty,option_1,option_1_image_url,option_2,option_2_image_url,option_3,option_3_image_url,option_4,option_4_image_url,answer_option_number
"Under the same conditions how many ml of 1M KOH and 0.5M H₂SO₄ solutions respectively, when mixed for a total volume of 100 ml, produces the highest rise in temperature?",,Chemistry,Thermochemistry,Neutralization,2,Medium,"67, 33",,"33, 67",,"40, 60",,"50, 50",,1
"Given, E° Zn²⁺/Zn = –0.763V and E° Ag⁺/Ag = +0.799V. The standard emf of the cell (E°) is given by",,Chemistry,Electrochemistry,Cell Potential,2,Medium,1.562 V,,0.036 V,,–1.562 V,,0.799 V,,1
Total volume of gaseous products at NTP obtained by electrolysis of dil. H₂SO₄ using 12A for 20 minutes is,,Chemistry,Electrochemistry,Electrolysis,2,Hard,1.67 liters,,3.34 liters,,2.5 liters,,5 liters,,2
The equivalent mass of an element is 4. Its vapour density is 3.225. The valency of the element is,,Chemistry,Equivalence,Equivalent Weight,2,Medium,2,,3,,4,,1,,4
The set of quantum numbers for 19th electron of Ca-atom is,,Chemistry,Atomic Structure,Quantum Numbers,2,Medium,"4, 0, 0, +½",,"4, 1, –1, +½",,"3, 2, 2, –½",,"3, 2, –2, +½",,1
The product formed on reacting propene with water in the presence of H₃PO₄ is,,Chemistry,Hydrocarbons,Electrophilic Addition,2,Medium,1-propanol,,2-propanol,,Propanal,,Propanone,,2
The gas formed by electrolysis of potassium fumarate can give,,Chemistry,Organic Tests,Functional Group Tests,2,Hard,Tollen’s test,,Baeyer’s test,,Bromine test,,All,,4
Formation of chloroalkane from alcohol by the action of SOCl₂ is also called,,Chemistry,Organic Reactions,Alcohol Derivatives,2,Medium,Darzen’s reaction,,Grove’s process,,Claisen condensation,,Wurtz reaction,,2
A and B are two independent events with P(A) = 2/3 and P(B) = 3/5 then P(A ∪ B) =,,Mathematics,Probability,Addition Rule,2,Medium,3/10,,7/15,,13/15,,1/5,,3
"In the expansion of (x2−1x)n(x^2 - \frac{1}{x})^n, ninth term is independent of x then n =",,Mathematics,Binomial Expansion,Independent Term,2,Hard,10,,12,,15,,18,,2
"In how many ways can the 3 digits even numbers greater than 500 be formed using the digits 0, 1, 2, 3, 4, 5 without repetition?",,Mathematics,Permutations,3-digit Numbers,2,Medium,12,,20,,24,,120,,3
If altitude of a triangle are in A.P. then sides of triangle are,,Mathematics,Geometry,Triangle Properties,2,Medium,equal,,in A.P.,,in G.P.,,in H.P.,,4
The average marks of A is 84 & the variance of marks is 16. Then C.V. of A is,,Mathematics,Statistics,Coefficient of Variation,2,Medium,4.76%,,5.23%,,6.32%,,7.14%,,1
The general values of θ satisfying tanθ + cotθ = 2cosecθ is,,Mathematics,Trigonometry,Equation Solving,2,Hard,"2nπ±π6,n∈I2n\pi ± \frac{\pi}{6}, n \in \mathbb{I}",,"2nπ±π3,n∈I2n\pi ± \frac{\pi}{3}, n \in \mathbb{I}",,"2nπ±π3,n∈I2n\pi ± \frac{\pi}{3}, n \in \mathbb{I}",,π+(–1)n⋅π6\pi + (–1)^n \cdot \frac{\pi}{6},,1
The elimination of the arbitrary constant from the equation y=emxy = e^{mx} gives the differential equation,,Mathematics,Differential Equations,Elimination of Constant,2,Medium,dydx=(yx)log⁡x\frac{dy}{dx} = \left( \frac{y}{x} \right) \log x,,dydx=(xy)log⁡y\frac{dy}{dx} = \left( \frac{x}{y} \right) \log y,,dydx=(yx)log⁡y\frac{dy}{dx} = \left( \frac{y}{x} \right) \log y,,dydx=(xy)log⁡x\frac{dy}{dx} = \left( \frac{x}{y} \right) \log x,,3
"A plane xa+yb+zc=3\frac{x}{a} + \frac{y}{b} + \frac{z}{c} = 3 meets the coordinate axes in P, Q, R then centroid of △PQR is",,Mathematics,3D Geometry,Centroid,2,Medium,"(a, b, c)",,"(a3,b3,c3)\left( \frac{a}{3}, \frac{b}{3}, \frac{c}{3} \right)",,"(1a,1b,1c)\left( \frac{1}{a}, \frac{1}{b}, \frac{1}{c} \right)",,"(a3,b3,c3)\left( \frac{a}{3}, \frac{b}{3}, \frac{c}{3} \right)",,2
question_text,question_image_url,course_name,chapter,Topic,marks,difficulty,option_1,option_1_image_url,option_2,option_2_image_url,option_3,option_3_image_url,option_4,option_4_image_url,answer_option_number
"A circle x2+y2+kx+4y+5=0x^2 + y^2 + kx + 4y + 5 = 0 passes through a point (1, 0) then which one of the following is an equation of a diameter of the circle?",,Mathematics,Coordinate Geometry,Circle Equation,2,Medium,x + y + 1 = 0,,k = 1,,x + y = 1,,2x + 5y = 4,,1
"If (a, b) is a mid-point of a chord passing through the vertex of a parabola y2=4xy^2 = 4x then",,Mathematics,Conic Sections,Parabola,2,Medium,a = 2b,,b² = 4a,,a² = 2b,,b² = 2a,,4
If y=e(1+log⁡x)y = e^{(1 + \log x)} then dydx\frac{dy}{dx} =,,Mathematics,Differentiation,Chain Rule,2,Easy,a,,e,,x,,logx,,3
A function f(x)=x3−27x+5f(x) = x^3 - 27x + 5 is an increasing function if,,Mathematics,Calculus,Increasing/Decreasing,2,Hard,,x,< 3,,,x,≥ 3,,
"∫x dxx(1+x5)=\int \frac{x \, dx}{x(1 + x^5)} =",,Mathematics,Integration,Standard Integral,2,Hard,log⁡(x41+x5)+c\log \left( \frac{x^4}{1 + x^5} \right) + c,,14log⁡(x+x5)+c\frac{1}{4} \log(x + x^5) + c,,14log⁡(x41+x5)+c\frac{1}{4} \log \left( \frac{x^4}{1 + x^5} \right) + c,,14(1+x5x)+c\frac{1}{4} \left( \frac{1 + x^5}{x} \right) + c,,3
The area bounded by the curve y=x2y = x^2 and a line y=xy = x is,,Mathematics,Area,Curve & Line,2,Easy,16\frac{1}{6} sq. unit,,13\frac{1}{3} sq. unit,,12\frac{1}{2} sq. unit,,56\frac{5}{6} sq. unit,,1
(a⃗+b⃗)×(a⃗−b⃗)(\vec{a} + \vec{b}) \times (\vec{a} - \vec{b}) is,,Mathematics,Vectors,Cross Product,2,Medium,a⃗2−b⃗2\vec{a}^2 - \vec{b}^2,,a null vector,,a like vector to a⃗×b⃗\vec{a} \times \vec{b},,an unlike vector to a⃗×b⃗\vec{a} \times \vec{b},,2
What does this passage mainly discuss?,,English,Reading Comprehension,Passage Theme,2,Medium,A change in role of blue harp,,Role of jug bands,,Invention of blues harp,,Performance of jug bands,,1
What does the phrase 'rural south' refer to?,,English,Vocabulary,Contextual Meaning,2,Easy,south direction,,countryside,,a city,,a band,,2
What can be inferred about George 'Bullet' Williams?,,English,Reading Comprehension,Inference,2,Medium,He belongs to jug bands,,He was a musician,,He used to play harp,,He influenced some of the latter harp men,,4
"According to the passage, where do jug bands not perform?",,English,Reading Comprehension,Fact Finding,2,Easy,street corners,,country stores,,city stage,,saloons,,3
question_text,question_image_url,course_name,chapter,Topic,marks,difficulty,option_1,option_1_image_url,option_2,option_2_image_url,option_3,option_3_image_url,option_4,option_4_image_url,answer_option_number
A soap bubble is formed in soap solution has excess pressure P in it. The soap bubble of same radius is formed in air has excess pressure of,,Physics,Properties of Matter,Surface Tension,1,Medium,P,,2P,,P2\frac{P}{2},,4P,,2
If aₜ and aᵣ represent radial and tangential accelerations. The motion of particle will be uniformly circular if,,Physics,Mechanics,Circular Motion,1,Medium,aᵣ = 0 & aₜ = 0,,aᵣ = 0 & aₜ ≠ 0,,aₜ ≠ 0 but aᵣ = 0,,aᵣ ≠ 0 & aₜ ≠ 0,,2
The amount of heat energy radiated per second by a surface depends on,,Physics,Heat,Radiation,1,Easy,Area of surface,,Difference in temperature between surface and surrounding,,Nature of surface,,All of above,,4
Two waves travelling in same medium have frequency 1:2 and their intensities 1:36 then ratio of their amplitude are,,Physics,Waves,Wave Parameters,1,Medium,1:3,,1:6,,1:8,,02:12,,2
Two small balls each carrying a charge 'q' are suspended by equal insulated strings of length 'l' from the hook of a stand. This arrangement is carried in a satellite in space then tension on each string will be,,Physics,Electrostatics,Charges in Space,1,Hard,q24πϵ04l2\frac{q^2}{4 \pi \epsilon_0 4l^2},,14πϵ0l2\frac{1}{4 \pi \epsilon_0 l^2},,q24πϵ0l2\frac{q^2}{4 \pi \epsilon_0 l^2},,q4πϵ0l\frac{q}{4 \pi \epsilon_0 l},,1
A wire of resistance 10Ω is stretched by one tenth of its original length then resistance will be,,Physics,Electricity,Resistance,1,Medium,11Ω,,12.1Ω,,13.2Ω,,15.5Ω,,4
A ray of light passes from vacuum into a medium of refractive index μ. The angle of incidence is found twice the angle of refraction: The angle of incidence is,,Physics,Optics,Refraction,1,Medium,cos⁻¹(μ/2),,2cos⁻¹(μ/2),,2sin⁻¹(μ/2),,sin⁻¹(μ/2),,1
In transistor α = 0.99 and emitter current changes by 5mA then change in collector current is,,Physics,Electronics,Transistors,1,Medium,0.196mA,,2.45mA,,4.95mA,,5.1mA,,3
The force is related with time by F = at + bt² then dimensional formula of b is,,Physics,Mechanics,Dimensional Analysis,1,Medium,T⁻²,,LT⁻¹,,MLT⁻⁴,,LT⁻⁴,,3
When a force F = 6i – 8j + 10k produce an acceleration of 1m/s² then mass of body is,,Physics,Mechanics,Newton's Laws,1,Medium,10√2 kg,,2√10 kg,,10 kg,,20 kg,,3
Ideal gas undergoing isothermal expansion means,,Physics,Thermodynamics,Isothermal Process,1,Easy,heat remain constant,,temperature and volume remain constant,,temperature and pressure remain constant,,temperature remain constant,,4
Velocity of sound is maximum in,,Physics,Sound,Velocity of Sound,1,Easy,water,,air,,steel,,vacuum,,3
question_text,question_image_url,course_name,chapter,Topic,marks,difficulty,option_1,option_1_image_url,option_2,option_2_image_url,option_3,option_3_image_url,option_4,option_4_image_url,answer_option_number
A wire has resistance 10Ω. A second wire of same material of double length and half of radius of cross section has resistance,,Physics,Electricity,Resistance,1,Medium,20 Ω,,40 Ω,,80 Ω,,160 Ω,,4
The wavelength of Kα line of an element of atomic no. 43 is λ then wavelength of Kα line for an element of atomic no. 29 is,,Physics,Modern Physics,X-ray Spectra,1,Hard,4329λ\frac{43}{29} \lambda,,4228λ\frac{42}{28} \lambda,,42λ\frac{4}{2} \lambda,,94λ\frac{9}{4} \lambda,,2
The number of electrons present in 3.4g of NH₃ is,,Chemistry,Mole Concept,Avogadro's Number,1,Medium,0.2Nₐ,,Nₐ,,2Nₐ,,5Nₐ,,3
"In the reaction 2A + B → A₂B, the reaction A will disappear at",,Chemistry,Chemical Kinetics,Reaction Rates,1,Medium,Half the rate that B will decrease,,The same rate that B will decrease,,The same rate that A₂B will form,,Twice the rate that B will decrease,,4
The Ksp of PbCl₂ is 5×10⁻⁵. The solubility of PbCl₂ is,,Chemistry,Equilibrium,Solubility Product,1,Hard,7.07 × 10⁻⁴ mols/litre,,5 × 10⁻³ mols/litre,,1 × 10⁻⁴ mols/litre,,1.41 × 10⁻³ mols/litre,,1
The pH of NH₄Cl solution is,,Chemistry,Acids and Bases,pH,1,Easy,7,,< 7,,> 7,,0,,2
The number of σ and π bonds in acetylene is,,Chemistry,Organic Chemistry,Bonding,1,Easy,2 and 1,,1 and 3,,3 and 2,,2 and 3,,1
The gas formed by passing NH₃ gas over heated sodium metal is,,Chemistry,Inorganic Chemistry,Gas Formation,1,Medium,N₂,,H₂,,N₂O,,N₂H₄,,4
Which of these is thermally unstable?,,Chemistry,Periodic Table,Stability of Compounds,1,Medium,Li₂CO₃,,Na₂CO₃,,K₂CO₃,,Rb₂CO₃,,1
The chemical representation of producer gas (used as a fuel) is,,Chemistry,Environmental Chemistry,Fuel Chemistry,1,Medium,CO + H₂,,CO + H₂O,,CO + NO₂,,CO + N₂,,1
The passivity of iron is due to,,Chemistry,Electrochemistry,Passivation,1,Medium,FeO,,Fe₂O₃,,Fe₃O₄,,Fe(NO₃)₃,,4
Which of these is an electrophile?,,Chemistry,Organic Chemistry,Reaction Types,1,Medium,NH₃,,SO₃,,CN⁻,,H₂O,,2
The byproduct formed during preparation of ethyl iodide is,,Chemistry,Organic Chemistry,Preparation of Alkyl Halides,1,Medium,H₃PO₄,,H₃PO₂,,H₃PO₃,,PH₃,,2
The hydrolysis of chloral with Ca(OH)₂ gives,,Chemistry,Organic Chemistry,Reaction with Ca(OH)₂,1,Medium,Chloroform,,Ethanal,,Ethanol,,Calcium acetate,,1
Oxidation of Toluene with air in presence of Mn⁺ and Cu⁺ salts as catalyst gives,,Chemistry,Organic Chemistry,Oxidation Reactions,1,Medium,Phenol,,Benzaldehyde,,Benzoic acid,,Anisole,,3
Which of the following is an intensive property?,,Chemistry,Thermodynamics,Intensive vs Extensive,1,Easy,Energy,,Mass,,Refractive index,,Volume,,3
If A is the subset of B then A ∪ B =,,Mathematics,Sets,Union of Sets,1,Easy,A,,B,,∅,,None,,2
"The multiplicative inverse of the complex number (1, 1) is",,Mathematics,Complex Numbers,Inverse,1,Medium,"(1, 1)",,"(12,12)\left( \frac{1}{2}, \frac{1}{2} \right)",,"(12,−12)\left( \frac{1}{2}, -\frac{1}{2} \right)",,"(−12,12)\left( -\frac{1}{2}, \frac{1}{2} \right)",,3
