question_text,question_image_url,course_name,chapter,Topic,marks,difficulty,option_1,option_1_image_url,option_2,option_2_image_url,option_3,option_3_image_url,option_4,option_4_image_url,answer_option_number
"If OP = 9 units and direction cosines of OP are proportional to 2, 1, -2, then the coordinates of P are",,Mathematics,3D Geometry,Direction Cosines,2,Medium,"(2, 1, -2)",,"(2/3, 1/3, -2/3)",,"(6, 3, -6)",,"(6, 3, 6)",,3
"If y = xˣ, then dy/dx =",,Mathematics,Calculus,Differentiation,2,Medium,xˣlogₑx,,xˣlogₑx,,xˣ(1 + logₑx),,xˣ(1 – logₑx),,3
"Let if xy = a² and z = bˣ + cʸ where a, b, c are positive constants then the minimum value of z is",,Mathematics,Calculus,Maxima-Minima,2,Hard,abc,,bc√a,,2abc,,2abc,,3
∫ √(1 + x²)/(√(1 – x²)) dx =,,Mathematics,Calculus,Integration,2,Hard,2sin⁻¹x – √(1 – x²) + c,,2 sin⁻¹ √(1 – x²) + c,,sin⁻¹x √(1 – x²) + c,,sin⁻¹x – 2 √(1 – x²) + c,,1
The area of the region bounded by the curve y = eˣ and the lines x = 0 and y = e is,,Mathematics,Calculus,Area Under Curve,2,Medium,1,,1/2,,e – 1,,e,,3
If a and b are two vectors of unit length and θ is the angle between them then,a – b,#ERROR!,,Mathematics,Vectors,Dot Product,2,Medium,sinθ,,2sinθ/2,,cosθ/2,,2cosθ/2
"In ΔABC, a = 2b and",A – B,#ERROR!,,Mathematics,Trigonometry,Triangle and Angles,2,Hard,π/4,,π/3,,π/6,,π/2
What does this passage mainly discuss?,,English,Reading Comprehension,Comprehension,2,Easy,A change in role of blue harp,,Role of jug bands,,Invention of blues harp,,Performance of jug bands,,2
What does the phrase 'rural south' refer to?,,English,Vocabulary,Contextual Meaning,2,Easy,a. south direction,,b. countryside,,c. a city,,d. a band,,2
What can be inferred about George 'Bullet' Williams?,,English,Reading Comprehension,Inference,2,Medium,a. He belongs to jug bands,,b. He was a musician,,c. He used to play harp,,d. He influenced some of the latter harp men,,4
"According to the passage, where do jug bands not perform?",,English,Reading Comprehension,Factual Information,2,Easy,a. street corners,,b. country stores,,c. city stage,,d. saloons,,3
question_text,question_image_url,course_name,chapter,Topic,marks,difficulty,option_1,option_1_image_url,option_2,option_2_image_url,option_3,option_3_image_url,option_4,option_4_image_url,answer_option_number
A body starts from rest and acquires a velocity v in time T. The work done on the body in time t will be proportional to,,Physics,Mechanics,"Work, Power, Energy",1,Medium,v/T·t,,v²/T,,v²/T·t,,v²/2,,3
A mass M is moving with a constant velocity along x-axis. Its angular momentum with respect to origin is,,Physics,Mechanics,Angular Momentum,1,Easy,zero,,non-constant,,goes on increasing,,goes on decreasing,,1
The quark combination of antineutron is,,Physics,Modern Physics,Particle Physics,1,Medium,uud,,udd,,ūūđ,,ūđđ,,4
Two sound waves of equal intensity 'I' produce beats. The maximum intensity of sound produced in beats will be,,Physics,Waves,Beats,1,Easy,4I,,I,,2I,,½I,,1
When charge is placed on a soap bubble then,,Physics,Electrostatics,Properties of Conductors,1,Medium,it collapse,,its radius increases,,its radius decreases,,radius may increase or decrease,,2
Two wires of same dimensions but resistivities ρ₁ and ρ₂ are connected in series. The equivalent resistivity of combination is,,Physics,Current Electricity,Resistivity,1,Medium,2(ρ₁ + ρ₂),,√(ρ₁ρ₂),,(ρ₁ + ρ₂)/2,,ρ₁ + ρ₂,,3
"Length of a body is L. It is kept at a distance u from a concave mirror of focal length ‘f’, then length of image will be",,Physics,Optics,Mirror Formula,1,Hard,L (u - f)/f,,L f/(u - f),,L (u/f),,L (f/u),,2
Current amplification in common base transistor is 0.96 then current gain when used in common emitter mode is,,Physics,Electronics,Transistor,1,Medium,16,,24,,28,,32,,3
The ratio of area within the orbit of electron for first excited state to ground state for Hydrogen atom is,,Physics,Modern Physics,Bohr’s Model,1,Hard,2:1,,8:1,,4:1,,16:1,,4
The position vector of a particle is r = a cosωt î + a sinωt ĵ then velocity of particle is,,Physics,Kinematics,Vectors,1,Hard,Parallel to position vector,,Perpendicular to position vector,,Directed towards origin,,Directed away from origin,,2
A cable breaks if stretched by more than 2 mm. If it is cut into two equal parts then the elongation for which it can break is,,Physics,Properties of Matter,Elasticity,1,Medium,0.25 mm,,0.5 mm,,1 mm,,2 mm,,3
Beats are not noticed if difference in frequencies is,,Physics,Waves,Beats,1,Easy,4,,6,,8,,12,,4
When distance between two charged particle is made one third then force between them will be,,Physics,Electrostatics,Coulomb’s Law,1,Easy,double,,triple,,four times,,nine times,,4
question_text,question_image_url,course_name,chapter,Topic,marks,difficulty,option_1,option_1_image_url,option_2,option_2_image_url,option_3,option_3_image_url,option_4,option_4_image_url,answer_option_number
The threshold wavelength of metal is 4000 Å then light of wavelength 3000 Å incident on metal then stopping potential will be,,Physics,Modern Physics,Photoelectric Effect,1,Medium,1.7 V,,1.6 V,,1.5 V,,1 V,,1
The total number of atoms present in 5.6 liters of ammonia gas at STP is,,Chemistry,Mole Concept,Avogadro’s Law,1,Medium,1.5057 × 10²³,,1.5057 × 10²²,,6.023 × 10²²,,6.023 × 10²³,,4
Carbon atom has 2 unpaired electrons is obtained using,,Chemistry,Atomic Structure,Electronic Configuration,1,Easy,Exclusion principle,,auf-bau principle,,Hund’s rule,,Bohr-Bury’s rule,,3
Which of the following is not a characteristics of transition elements?,,Chemistry,Transition Elements,Properties,1,Medium,Variable oxidation states,,Tendency to form complexes,,Formation of colored compounds,,Natural radioactivity,,4
The Sandmeyer’s reaction of diazonium salts is a replacement reaction of N₂ by,,Chemistry,Organic,Reactions of Diazonium Salts,1,Medium,Hydroxyl group,,Copper,,Hydrogen,,Halogen,,2
"In the reaction, Cr₂O₇⁻² + H⁺ + ne⁻ → Cr³⁺ + H₂O. The value of n in the balanced equation is",,Chemistry,Redox,Balancing Equations,1,Hard,3,,4,,5,,6,,4
"In which of this case, anionic hydrolysis occurs?",,Chemistry,Hydrolysis,Types,1,Medium,NaNO₃,,NH₄Cl,,KCN,,CuSO₄,,3
Exhausted permutit can be recharged using,,Chemistry,Environmental Chemistry,Water Softening,1,Medium,NaCl,,NaOH,,CaCl₂,,KOH,,1
Carnallite is used for the extraction of,,Chemistry,Metallurgy,Ores & Extraction,1,Easy,Cl₂,,Br₂,,F₂,,I₂,,2
The reducing agent in the Bessemer converter during extraction of copper from copper pyrite is,,Chemistry,Metallurgy,Copper Extraction,1,Medium,C,,CO,,H₂,,Cu₂O,,1
Butyl alcohol and iso-butyl alcohol are,,Chemistry,Organic Chemistry,Isomerism,1,Easy,position isomers,,chain-isomers,,metamers,,both position and chain isomers,,4
The hydrocarbon formed by the hydrolysis of beryllium carbide is,,Chemistry,Inorganic Chemistry,Hydrolysis,1,Medium,methane,,ethane,,acetylene,,propylene,,3
The test used to detect –NO₂ group is,,Chemistry,Organic Chemistry,Functional Group Test,1,Medium,Tollen’s test,,Baeyer’s test,,Baker-Mullikan’s test,,Fehling’s test,,3
The reagent with which both acetaldehyde and acetone react easily is,,Chemistry,Organic Chemistry,Carbonyl Reactions,1,Medium,Fehling’s solution,,Grignard reagent,,Schiff’s reagent,,Tollen’s reagent,,3
Which of the following compounds show tautomerism?,,Chemistry,Organic Chemistry,Tautomerism,1,Medium,Chloral,,Benzaldehyde,,Nitrobenzene,,None of them,,3
The negation of the proposition “If 2 is prime then 3 is odd” is,,Mathematics,Logic,Statements,1,Medium,If 2 is not prime then 3 is not odd,,2 is prime and 3 is not odd,,2 is not prime 3 is not odd,,If 2 is not prime then 3 is odd,,2
"Product of the roots of the equation mx² + 6x + (2m – 1) = 0 is –1, then m =",,Mathematics,Algebra,Quadratic Equations,1,Medium,1,,1/3,,–1,,–1/3,,4
question_text,question_image_url,course_name,chapter,Topic,marks,difficulty,option_1,option_1_image_url,option_2,option_2_image_url,option_3,option_3_image_url,option_4,option_4_image_url,answer_option_number
The sum of infinity of the series 1 – 1/2 + 1/4 – 1/8 + … is,,Mathematics,Sequences & Series,Infinite Series,1,Easy,2,,1/2,,2/3,,3/2,,3
The principal value of sin⁻¹(sin 5π/6) is,,Mathematics,Trigonometry,Inverse Trigonometric Functions,1,Easy,π/6,,5π/6,,7π/6,,–π/6,,4
If a be a unit vector perpendicular to unit vectors b and c and if angle between b and c is α then b × c is,,Mathematics,Vectors,Cross Product,1,Medium,sinα,,b,,c,,a,,4
The co-variance between independent variables is,,Mathematics,Statistics,Covariance,1,Easy,1,,–1,,0,,Infinity,,3
The eccentricity of the ellipse 25x² + 4y² = 1 is,,Mathematics,Conic Sections,Ellipse,1,Medium,√21/25,,√21/2,,√29/25,,√29/2,,2
limₓ→π/2 (secθ – tanθ) =,,Mathematics,Limits,Trigonometric Limits,1,Medium,0,,1,,–1,,2,,3
The derivative of cos⁻¹(2x² – 1) w.r.t. cos⁻¹x is,,Mathematics,Calculus,Differentiation,1,Hard,2,,2/√(1 – x²),,2√(1 – x²),,1 – x²,,2
∫ dx / (4x² + 25) =,,Mathematics,Calculus,Integration,1,Medium,(2/5) tan⁻¹(2x/5) + c,,(1/10) tan⁻¹(2x/5) + c,,(5/4) tan⁻¹(2x/5) + c,,(1/5) tan⁻¹(2x/5) + c,,4
The range of the function f(x) = sinx + 2cosx is,,Mathematics,Functions,Range of Functions,1,Medium,"[1, 2]",,"(–∞, +∞)",,"[–√5, √5]",,"(–5, 5)",,3
Choose the correct answer: Every scalar matrix is,,Mathematics,Matrices,Types of Matrices,1,Easy,an identity matrix,,scalar matrix,,a diagonal matrix,,a square matrix whose each element is 1,,3
The conjugate of complex number z is the reflection of z about,,Mathematics,Complex Numbers,Geometry of Complex Numbers,1,Easy,origin,,x-axis,,y-axis,,line y = x,,2
The most general value of θ which satisfies sinθ = √3/2 and cosθ = –1/2 is,,Mathematics,Trigonometry,General Solutions,1,Medium,2nπ + 5π/3,,nπ + 5π/3,,2nπ + π/3,,2nπ + π/6,,1
The gradient of line ax + by + c = 0 is undefined if,,Mathematics,Coordinate Geometry,Straight Lines,1,Easy,a = 0,,b = 0,,a = b = 0,,none,,2
"If sum of slopes of lines represented by 2x² + kxy + 3y² = 0 is twice the product of slopes, then K =",,Mathematics,Coordinate Geometry,Pair of Lines,1,Medium,4,,12,,–3,,–4,,3
"For any two independent events A & B, P(A) = 0.3 & P(B) = 0.2 then P(A ∩ B) =",,Mathematics,Probability,Independent Events,1,Easy,0.06,,0.52,,0.84,,0.1,,1
"If h(x) = f(x) + f(–x), then h(x) has got an extreme value at the point where f′(x) is",,Mathematics,Calculus,Maxima & Minima,1,Medium,even function,,odd function,,zero,,neither odd nor even,,3
question_text,question_image_url,course_name,chapter,Topic,marks,difficulty,option_1,option_1_image_url,option_2,option_2_image_url,option_3,option_3_image_url,option_4,option_4_image_url,answer_option_number
∫ dx/√(1–x²) =,,Mathematics,Calculus,Integration,1,Easy,–sin⁻¹x + c,,sin⁻¹x + c,,cos⁻¹x + c,,log(x + √(1–x²)) + c,,2
"If A = [2 3; K 4] is singular matrix, then K =",,Mathematics,Matrices,Determinant,1,Medium,4/3,,5/3,,8/3,,3,,1
We saw him ... out.,,English,Grammar,Verb Tense,1,Easy,to come,,come,,having come,,came,,1
I had sooner ... than ...,,English,Grammar,Sentence Structure,1,Medium,"run, walk",,"running, walking",,"run, walking",,"running, walk",,1
"The phonemic transcription of the word ""foreword"" is",,English,Phonetics,Transcription,1,Hard,/fɔːwəd/,,/fɔːwɜːd/,,/fɒwəd/,,/fɔːwəʳd/,,4
The word ‘forename’ has its primary stress on the ... syllable.,,English,Phonetics,Stress,1,Medium,1st,,2nd,,3rd,,None of these,,1
Coop:,,English,Vocabulary,Word Meaning,1,Easy,a place where fouls are kept,,a place where clothes are kept,,overthrow of government of military,,none of the above,,1
All his neighbours are aware of his acrimonious nature.,,English,Vocabulary,Synonyms,1,Medium,informal,,sympathetic,,uncooperative,,charitable,,3
A snake in the grass:,,English,Vocabulary,Idioms,1,Easy,a secret or hidden enemy,,no reliable person,,very ferocious snake,,unrecognizable danger,,1
Choose the correct conditional sentence.,,English,Grammar,Conditional Sentences,1,Medium,Buy a car and it will cost you a fortune.,,Buy a car if you have money.,,Buy a car and it costs you a fortune.,,Buy a car if you will have money.,,2
My means ... limited.,,English,Grammar,Subject-Verb Agreement,1,Easy,is,,are,,was,,none of these,,1
I look forward to ... my old friend next month.,,English,Grammar,Infinitives & Gerunds,1,Easy,meet,,meeting,,be met,,to be met,,2
The lighting ... across the sky.,,English,Grammar,Tense,1,Easy,flashed,,flashes,,is flashing,,had flashed,,1
She disliked ... coming late.,,English,Grammar,Gerund & Infinitive,1,Easy,me,,my,,mine,,myself,,2
A bus starts to move with an acceleration 2 m/s² and a cyclist 96m behind the bus moves towards bus with 20 m/s. The time after which cyclist overtakes the bus is,,Physics,Kinematics,Relative Motion,2,Medium,4 s,,8 s,,12 s,,16 s,,2
A block rests on a rough inclined plane making an angle 30° with the horizontal. The coefficient of static friction between the block and plane is 0.8 and frictional force on block is 10N then mass of block is,,Physics,Mechanics,Friction,2,Hard,2 kg,,4 kg,,1.5 kg,,2.5 kg,,3
The minimum energy required to launch a satellite of ‘m’ from surface of earth to an orbit at a height ‘2R’ from surface of earth of radius R is,,Physics,Gravitation,Energy,2,Medium,3 mgR,,5/6 mgR,,2 mgR,,1/5 mgR,,2
question_text,question_image_url,course_name,chapter,Topic,marks,difficulty,option_1,option_1_image_url,option_2,option_2_image_url,option_3,option_3_image_url,option_4,option_4_image_url,answer_option_number
"A cube of wood supporting a 300g mass just float in water. When mass is removed, then cube rises by 4 cm then size of cube is",,Physics,Mechanics,Archimedes' Principle,2,Medium,5√2 cm,,5√5 cm,,5√3 cm,,7 cm,,3
"A piece of iron fall from a height of 1 km then rise in temperature, if sp heat capacity of iron is 0.1 kcal/kg°C & 10% energy is converted into heat",,Physics,Heat,Energy Conversion,2,Medium,0.23°C,,2.3°C,,0.46°C,,4.6°C,,2
"Two small identical conducting spheres A and B possess charges +6μC and –2μC are at 30cm apart. They are touched and placed at 30 cm, the force between them will be",,Physics,Electrostatics,Coulomb's Law,2,Medium,0.6N,,0.7N,,0.8N,,0.9N,,2
A battery has emf 4V. This battery is connected with resistance of 2Ω then current of 1A flows. The current flows when terminal of battery are connected directly is,,Physics,Current Electricity,Ohm's Law,2,Medium,1A,,2A,,4A,,infinite,,4
A galvanometer of resistance 100Ω is converted into a voltmeter of range 10V by connecting a resistance of 10Ω. The resistance required to convert the galvanometer into ammeter of range 1A is,,Physics,Current Electricity,Meters,2,Medium,0.4Ω,,0.3Ω,,0.2Ω,,0.1Ω,,4
Emf of source is E = 50√2 sin100t is connected across capacitor of 1μF then ammeter reading will be,,Physics,AC Circuit,Capacitor in AC,2,Hard,2.5 mA,,5√2 mA,,5 mA,,√2 mA,,2
The focal length of objective of an astronomical telescope is 1m and magnifying power is 20. The length of telescope for relaxed eye is,,Physics,Optics,Telescope,2,Medium,85 cm,,95 cm,,105 cm,,115 cm,,3
Light of wavelength 6328 Å is incident on a slit having width 0.2mm. The width of central maxima from minimum to minimum is,,Physics,Wave Optics,Diffraction,2,Medium,0.09°,,0.18°,,0.36°,,0.72°,,3
The activity of radioactive source is 1.6 curie and has half life 2.5 days. The activity after 10 days will be,,Physics,Modern Physics,Radioactivity,2,Medium,0.8 curie,,0.16 curie,,0.4 curie,,0.2 curie,,2
The wavelength of first member of Paschen series is 18800 Å then shortest wavelength of same series is,,Physics,Modern Physics,Hydrogen Spectrum,2,Medium,1160 Å,,12850 Å,,8225 Å,,9252 Å,,4
The number of Faradays of charge required to reduce 1 mole of Cr₂O₇²⁻ in acidic medium is,,Chemistry,Electrochemistry,Faraday's Law,2,Medium,6,,12,,3,,4,,1
4.41 grams of a dibasic acid was dissolved in 250 ml of solution. 25 ml of the solution required 14 ml of 0.5 N NaOH for complete neutralization. The molecular weight of acid is,,Chemistry,Acid-Base,Neutralization,2,Hard,90,,98,,126,,112,,2
The conversion of molecules of A and B follows a second order kinetics. Doubling the concentration of A will increase the rate of formation of B by a factor of,,Chemistry,Kinetics,Order of Reaction,2,Medium,2,,4,,1/2,,1/4,,2
The gas formed by roasting of iron pyrite is a/an,,Chemistry,Metallurgy,Roasting,2,Easy,oxidant,,reductant,,bleacher,,all of these,,1
In the sequence of reaction: C₆H₅N₂Cl →(H₃PO₂)→ C₆H₆ →(CH₃Cl/AlCl₃)→ C₆H₅CH₃,,Chemistry,Organic Chemistry,Reaction Sequence,2,Medium,Benzene,,Toluene,,Chlorobenzene,,Xylene,,2
question_text,question_image_url,course_name,chapter,Topic,marks,difficulty,option_1,option_1_image_url,option_2,option_2_image_url,option_3,option_3_image_url,option_4,option_4_image_url,answer_option_number
"Consider the reaction, CaCO₃(s) ⇌ CaO(s) + CO₂(g). In closed container at equilibrium, what would be the effect of addition of CaCO₃ on the equilibrium concentration of CO₂?",,Chemistry,Equilibrium,Le Chatelier's Principle,2,Medium,Increases,,Decreases,,Remains unaffected,,Data is insufficient,,3
A solution of SO₂ in water reacts with H₂S precipitating sulphur. Here SO₂ acts as,,Chemistry,Redox,Oxidizing/Reducing Agent,2,Medium,An oxidizing agent,,A reducing agent,,Acid,,Catalyst,,1
The oxidation number of ‘S’ in Marshall’s acid is,,Chemistry,Redox,Oxidation Number,2,Medium,=+7,,=+6,,=+4,,5,,1
"Let f(x) = αx / (x – 1), x ≠ 1 then for what values of α is f(f(x)) = x?",,Mathematics,Functions,Composite Functions,2,Medium,√2,,–√2,,2,,–2,,4
The value of the determinant |1 1 1; 1+a 1 1; 1 1+a 1| is,,Mathematics,Matrices,Determinants,2,Medium,a(1 – 2a),,a(1 + 3a),,a(1 – 3a),,a(1 + 2a),,1
"If n is not a multiple of 3, then the coefficient of xⁿ in the expansion of logₑ(1 + x + x²) is",,Mathematics,Algebra,Series Expansion,2,Hard,n,,2,,1,,0,,4
The maximum number of different squares which can be formed on a chessboard is,,Mathematics,Permutation,Counting,2,Medium,64,,65,,204,,1296,,4
"Equation of the curve passing through (1, 1) and satisfying the differential equation dy/dx = 2y/x (x > 0, y > 0) is given by",,Mathematics,Calculus,Differential Equations,2,Hard,x² = y,,x = y²,,x = 2y,,y = x²,,4
If the pair of lines 5x² – pxy – 5y² = 0 and 3x² – qxy – 3y² = 0 be such that each pair bisects the angle between the other pair then,,Mathematics,Coordinate Geometry,Pair of Lines,2,Hard,pq = 5,,pq = –20,,p = –20,,q = –20,,2
"The range and its coefficient from the following data: X = 0–10, 10–20, 20–30, 30–40, 40–50; f = 3, 4, 5, 6, 7",,Mathematics,Statistics,Range,2,Medium,"6, 0.3",,"40, 0.5",,"50, 1",,"50, 0.5",,4
If the tangents to the parabola y² = 4ax drawn at points 't₁' and 't₂' meet on the axis then,,Mathematics,Conic Sections,Parabola,2,Medium,t₁t₂ = –1,,t₁t₂ = 2,,t₁t₂ = 4,,t₁ + t₂ = 0,,4
"The projection of a line segment joining two end points (1, 2, 3) and (3, 4, 5) on a line with direction cosines 1/√3, 1/√3, 1/√3 is",,Mathematics,3D Geometry,Projection,2,Medium,√3,,2√3,,√2,,6√3,,2
"If y = √logx + √logx + √logx + ..., then dy/dx =",,Mathematics,Calculus,Differentiation,2,Hard,2y – 1 / x(2y – 1),,2y – 1 / x(y – 1),,x(2y – 1),,x(y – 1),,1
question_text,question_image_url,course_name,chapter,Topic,marks,difficulty,option_1,option_1_image_url,option_2,option_2_image_url,option_3,option_3_image_url,option_4,option_4_image_url,answer_option_number
The chance that A can solve the problem is 3/5 and the chance that B can solve the problem is 2/5. Find the probability that the problem is solved by A & B.,,Mathematics,Probability,Independent Events,2,Medium,1/5,,2/5,,3/5,,4/5,,4
∫ dx / √(x – α)(x – β) =,,Mathematics,Calculus,Integration,2,Medium,log(√(x – α) – √(x – β)),,2log(√(x – α) + √(x – β)) + c,,tan⁻¹(√(x – α)/(x – β)),,sin⁻¹(√(x – α)/(x – β)),,2
The area bounded by the curve x² = 4a (y – 2a) and line y = 6a is,,Mathematics,Calculus,Area Under Curve,2,Medium,32a²/3,,8a²/3,,16a²/3,,32a²/3√a,,1
"If a × b = λ c ≠ 0 then for any scalar λ,",,Mathematics,Vectors,Vector Triple Product,2,Medium,a · b = –λb,,b · a = –λb,,a – b = λ(c – b),,a – b = λ(c – a),,4
If the area of ΔABC be A then a²sin2B + b²sin2A =,,Mathematics,Trigonometry,Triangle Properties,2,Medium,2A,,4A,,b,,A/2,,2
"The metal becomes plastics, means",,English,Comprehension,Reading,2,Easy,the metal becomes plastics,,the metal is converted into plastics,,the metal is molded into shapes,,the metal behaves like plastics,,4
One statement of advice is made for,,English,Comprehension,Reading,2,Easy,increasing temperature of iron,,taking care for surfaces,,oxidation of metal in high temperature,,use of different types of weld,,2
The best suitable title of this text is,,English,Comprehension,Title,2,Easy,objective of the welding,,importance of flux in welding,,different types of welding,,process of pressure welding,,4
What might be the topic of the following paragraph?,,English,Comprehension,Topic Identification,2,Easy,another method of weld,,methods of joining metals,,welding steel,,importance of welding,,4
question_text,question_image_url,course_name,chapter,Topic,marks,difficulty,option_1,option_1_image_url,option_2,option_2_image_url,option_3,option_3_image_url,option_4,option_4_image_url,answer_option_number
A car moving with speed of 50 km/hr can be stopped by brakes at least 6 m. If same car is moving at a speed of 100 km/hr then minimum distance at which car can be stopped is,,Physics,Mechanics,Laws of Motion,1,Medium,6 m,,12 m,,18 m,,24 m,,4
A particle performs uniform circular motion with an angular momentum L. If the frequency of particle motion is doubled and radius is halved then new angular momentum becomes,,Physics,Mechanics,Rotational Motion,1,Hard,2L,,4L,,L/2,,L/4,,2
The velocity of wave is 330 m/s. The path difference of 40 cm is equivalent to phase difference of 1.6π. The frequency of wave is,,Physics,Waves,Wave Motion,1,Medium,165 Hz,,150 Hz,,660 Hz,,330 Hz,,3
A gas at 250 K is heated in a vessel through 1°C then % increase in pressure will be,,Physics,Heat,Gas Laws,1,Easy,0.1%,,0.2%,,0.3%,,0.40%,,3
"Air filled parallel plate capacitor is charged to potential V₁, is connected to an uncharged identical parallel plate capacitor of dielectric constant k then common potential become V₂. The value of k is",,Physics,Electrostatics,Capacitors,1,Hard,(V₁ – V₂)/(V₁ + V₂),,V₁/(V₁ – V₂),,V₁ – V₂/V₂,,V₁ – V₂/V₁,,1
Sensitivity of a potentiometer can be increased by,,Physics,Current Electricity,Potentiometer,1,Medium,increasing emf of cell,,increasing length of potentiometer wire,,decreasing length of potentiometer,,all of above,,4
A thin convex lens is placed in contact of thin concave lens of same focal length. The focal length of combination will be,,Physics,Optics,Lens Combination,1,Easy,f,,2f,,0,,∞,,3
"During x-ray production, the current is increased then",,Physics,Modern Physics,X-ray,1,Medium,penetration power increases,,penetration power decreases,,intensity of x-ray increases,,intensity of x-ray decreases,,3
The current gain in a transistor is 40 and emitter current is 8.2 mA then base current is,,Physics,Electronics,Transistor,1,Medium,0.02 mA,,0.2 mA,,2 mA,,0.4 mA,,2
The momentum of particle is p = 2cosθ î + 2sinθ ĵ. The angle between force acting on particle and momentum will be,,Physics,Mechanics,Vectors,1,Medium,45°,,90°,,120°,,135°,,2
Two water droplets merge with each other to form a larger droplet the energy is,,Physics,Properties of Matter,Surface Tension,1,Medium,liberated,,absorbed,,neither liberated nor absorbed,,mass is converted into energy,,1
question_text,question_image_url,course_name,chapter,Topic,marks,difficulty,option_1,option_1_image_url,option_2,option_2_image_url,option_3,option_3_image_url,option_4,option_4_image_url,answer_option_number
A mark on table is viewed by a rectangular glass of thickness ‘d’ and refractive index ‘μ’ then the mark will appear to be raised by,,Physics,Optics,Refraction,1,Medium,(μ + 1)/μ · d,,(μ – 1)/μ · d,,(μ + 1)/d,,(μ – 1) · d,,2
Three charges of +2C are placed at corner of an equilateral triangle. The force between two charges is F then net force on either charge will be,,Physics,Electrostatics,Coulomb’s Law,1,Medium,3F,,2F,,√2F,,√3F,,4
The minimum potential required to excite the hydrogen atom in ground state is,,Physics,Modern Physics,Hydrogen Atom,1,Easy,13.6 V,,10.2 V,,3.4 V,,12.1 V,,1
Mass of water formed by heating 32 gm of H₂ with 32 gm of oxygen is,,Chemistry,Stoichiometry,Limiting Reagent,1,Medium,35 gm,,36 gm,,27 gm,,30 gm,,4
6.72 gm of metal displaced 112 ml of H₂ at NTP. The eq. wt. of metal is,,Chemistry,Redox,Equivalent Weight,1,Medium,12,,9,,6,,4,,1
Which of these has sp hybridization?,,Chemistry,Chemical Bonding,Hybridization,1,Easy,NO₂⁺,,C₂H₂,,HCN,,All,,4
MnO₄⁻ + H⁺ + S²⁻ → Mn²⁺ + H₂O + S. In the above reaction the eq. wt. of MnO₄⁻ is,,Chemistry,Redox,Equivalent Weight,1,Medium,F.M./2,,F.M./5,,F.M./6,,F.M./7,,4
Which of the following is an example of acid salt,,Chemistry,Acid-Base,Salt Types,1,Medium,NaH₂PO₂,,NaHCO₃,,NaNO₃,,All,,2
