question_text,question_image_url,course_name,chapter,Topic,marks,difficulty,option_1,option_1_image_url,option_2,option_2_image_url,option_3,option_3_image_url,option_4,option_4_image_url,answer_option_number
Fermentation is catalyzed by:,,Chemistry,Mix,Enzymes,1,Easy,Zymase,,Amylase,,Invertase,,Maltase,,1
What happens when salt bridge is removed from electrochemical cell?,,Chemistry,Mix,Salt bridge,1,Medium,Voltage drops to zero,,Voltage doesn’t change,,Voltage increases rapidly,,Voltage increases gradually,,1
Bond angle is maximum for:,,Chemistry,Mix,Molecular geometry,1,Easy,H₂O,,NH₃,,CO₂,,Ozone,,3
For an endothermic reaction:,,Chemistry,Mix,Thermochemistry,1,Hard,"High pressure, low temperature",,"Low pressure, high temperature",,"High pressure, high temperature",,"Low pressure, low pressure",,2
Tollens reagent test is given by:,,Chemistry,Mix,Aldehydes & ketones,1,Medium,CH₃COCH₃,,CH₃CH₂COCH₃,,CH₃CHO,,None of the above,,3
Which one follows SN1 mechanism?,,Chemistry,Mix,Reaction mechanisms,1,Hard,1-chloropropane,,2-chloropropane,,tert-butyl chloride,,2-methyl-1-chloropropane,,3
Which one of the following is the most basic amine?,,Chemistry,Mix,Amines,1,Medium,Aniline,,Benzyl amine,,Diphenyl amine,,Triphenyl amine,,2
Highest dipole moment:,,Chemistry,Mix,Dipole moment,1,Medium,CH₃Cl,,CH₃F,,CH₃Br,,CH₃I,,2
Oil of Mirbane is:,,Chemistry,Mix,Aromatic compounds,1,Easy,Nitrobenzene,,Benzaldehyde,,Acetaldehyde,,Hydrochloric acid,,1
Oleum is obtained in:,,Chemistry,Mix,Sulphuric acid manufacture,1,Medium,Fractionation tower,,Absorption tower,,Reactor tower,,Distillation tower,,2
Bleaching powder reacts with HCl to give:,,Chemistry,Mix,Chlorine compounds,1,Medium,Cl₂,,O₂,,Chlorous acid,,Calcium,,1
Which of the following alcohol gives the Lucas test fastest?,,Chemistry,Mix,Alcohol reactions,1,Easy,1° alcohol,,2° alcohol,,3° alcohol,,All will react at the same rate,,3
Water gas is:,,Chemistry,Mix,Fuel gases,1,Easy,CO + H₂O,,CO + H₂,,2CO + H₂O,,CO₂ + H₂O + Cl₂,,2
Which of the following is not fatal to our body?,,Chemistry,Mix,Elements,1,Easy,Fe,,Cu,,Hg,,Ar,,4
The value for entropy change for a reversible reaction at absolute zero is:,,Chemistry,Mix,Entropy,1,Medium,Zero,,Negative,,Cannot be determined,,Positive,,1
Alcohol is less volatile than ether because:,,Chemistry,Mix,Physical properties,1,Medium,Intermolecular H-bonding in alcohol,,Intramolecular H-bonding in alcohol,,Alcohol has a higher boiling point than ether,,Ether has a higher boiling point than alcohol,,1
Slaked lime is used in manufacture of:,,Chemistry,Mix,CaO & Ca(OH)₂ uses,1,Easy,Cement,,Glass,,Fertilizer,,Soap,,1
Exhausted zeolite reappears by the help of:,,Chemistry,Mix,Zeolite process,1,Easy,Brine solution,,Heating at high temperature,,Mixing with a catalyst,,Adding a reducing agent,,1
Coordination number of cubic crystal is:,,Chemistry,Mix,Crystal structures,1,Medium,4,,5,,6,,8,,4
Tetrahedral structure of carbon was proposed by:,,Chemistry,Mix,Structure of carbon,1,Easy,Pauling,,Wohler,,Van’t Hoff and Le Bel,,Berthelot,,3
When aniline reacts with NaNO₂ and dil. HCl then it forms:,,Chemistry,Mix,Diazonium salts,1,Hard,BDC,,Nitrobenzene,,Toluene,,Chlorobenzene,,1
Which of the following is a basic salt?,,Chemistry,Mix,Salts,1,Easy,Sodium chloride,,Calcium carbonate,,Sodium bicarbonate,,Ammonium chloride,,2
Which represents first law of thermodynamics?,,Chemistry,Mix,First law,1,Medium,W = E + P(V₂ - V₁),,Q = E + P(V₂ - V₁),,Q + E = P(V₂ - V₁),,Q - E = P(V₂ - V₁),,2
Fishy smell is due to:,,Chemistry,Mix,Amines,1,Easy,NH₃,,H₂S,,HCl,,CH₃Cl,,2
Maximum catenation property is shown by:,,Chemistry,Mix,Carbon properties,1,Easy,Carbon,,Silicon,,Nitrogen,,Germanium,,1
Which of the following is fibrous raw material for paper?,,Chemistry,Mix,Polymers,1,Easy,Cotton,,NaOH,,Starch,,Wax,,1
Which isomerization is shown by propan-1-ol and propan-2-ol?,,Chemistry,Mix,Isomerism,1,Medium,Positional isomerism,,Functional isomerism,,Metamerism,,Chain isomerism,,1
H₂O₂ acts as oxidizing agent in:,,Chemistry,Mix,Hydrogen peroxide,1,Medium,Neutral medium,,Acidic medium,,Alkaline medium,,Acidic and alkaline medium,,4
Which is not soluble in water?,,Chemistry,Mix,Solubility of salts,1,Easy,PbSO₄,,Bi₂(SO₄)₃,,Na₂CO₃,,Na₂SO₄,,1
Marshall’s acid is:,,Chemistry,Mix,Acids,1,Medium,H₂S₂O₅,,H₂S₂O₈,,H₂S₂O₇,,H₂SO₄,,2
Benzene diazonium chloride reacts with phenol in alkaline medium to give:,,Chemistry,Mix,Diazotization,1,Hard,Chlorobenzene,,p-Hydroxyazobenzene,,Azobenzene,,Benzene,,2
"For the production of H₂S in the lab, we use:",,Chemistry,Mix,Lab preparation of gases,1,Easy,Kipp apparatus,,Haber’s process,,Contact process,,Solvay process,,1
Tailing of mercury is due to the formation of:,,Chemistry,Mix,Metals,1,Medium,HgO,,Hg₂O,,Hg₂Cl₂,,H₂O₂,,3
Which of the following acts as both oxidizing and reducing agent?,,Chemistry,Mix,Oxidation states,1,Easy,H₂,,SO₂,,H₂S,,C,,2
Which of the following metal is leached by cyanide process?,,Chemistry,Mix,Cyanide process,1,Medium,Ag,,Na,,Ca,,Cu,,1
Which of the following factors can increase the rate of a chemical reaction?,,Chemistry,Mix,Rate of reaction,1,Easy,Decrease in temperature,,Increase in concentration of reactant,,Decrease in surface area of reactant,,None of the above,,2
Which of the following allotrope of phosphorus is most reactive?,,Chemistry,Mix,Phosphorus allotropes,1,Medium,Red phosphorus,,White phosphorus,,Black phosphorus,,Yellow phosphorus,,2
Leaf lamina is present in:,,Biology,Mix,Leaf parts,1,Easy,Rachis,,Peduncle,,Pedicel,,Petiole,,4
Foliage leaves of Pinus are borne on:,,Biology,Mix,Pinus,1,Medium,Branches of limited growth,,Branches of unlimited growth,,Both of above,,None of above,,1
"In yeast, the sexual reproduction is by conjugation. After fusion the zygotic nucleus divides meiotically and forms haploid spores. The unicellular structure with haploid spores is:",,Biology,Mix,Reproduction,1,Medium,Sporangium,,Gametangium,,Ascus,,Zoosporangium,,3
Phylloclade & cladode modification is found in:,,Biology,Mix,Stem modification,1,Medium,Xerophytes,,Mesophytes,,Hydrophyte,,Halophyte,,1
The common mode of sexual reproduction in Chlamydomonas is:,,Biology,Mix,Reproduction,1,Medium,Oogamous,,Isogamous,,Syngamous,,Anisogamous,,2
Saprophytic protist is:,,Biology,Mix,Nutrition,1,Easy,Slime mould,,Algae,,Protozoa,,Diatoms,,1
Self pollination is obligatory in closed bisexual flower. It is known as:,,Biology,Mix,Pollination,1,Medium,Cleistogamy,,Chasmogamy,,Geitonogamy,,Dicliny,,1
Which tissue system provides a covering for the plant body?,,Biology,Mix,Tissue systems,1,Easy,Periderm,,Dermal,,Vascular,,Ground,,2
Which of the following are complex tissues?,,Biology,Mix,Tissues,1,Medium,Parenchyma and collenchyma,,Collenchyma and sclerenchyma,,Xylem and phloem,,Xylem and parenchyma,,3
Which gas is contained in green house effect?,,Biology,Mix,Greenhouse gases,1,Easy,H₂,,C,,O₂,,CO₂,,4
IAA hormone is produced from:,,Biology,Mix,Plant hormones,1,Medium,Tryptophan,,Tyrosine,,Cytokinin,,Pomalin,,1
Abscisic acid is used for:,,Biology,Mix,Plant hormones,1,Medium,Stomatal closing,,Break seed dormancy,,Apical dominance,,Delay in ageing,,1
Fermentation is:,,Biology,Mix,Metabolism,1,Easy,Exothermic,,Endothermic,,Dehydrating,,Hydrolysis,,1
Auxin helps in:,,Biology,Mix,Plant hormones,1,Easy,Lateral growth,,Apical growth,,Secondary growth,,Both a and b,,4
Enzyme required for the fermentation process is:,,Biology,Mix,Fermentation,1,Easy,Zymase,,Invertase,,Sucrase,,Ligase,,1
Liverwort is:,,Biology,Mix,Examples,1,Easy,Marchantia,,Anthoceros,,Pella,,Funaria,,1
Best way to test paternity:,,Biology,Mix,Paternity test,1,Medium,Punnett square,,Family tree,,Pedigree analysis,,Electrophoresis,,3
A gene located in Y chromosome and therefore transmitted from father to son is known as:,,Biology,Mix,Y-linked inheritance,1,Medium,Holoandric gene,,Duplicate gene,,Complementary gene,,Supplementary gene,,1
Down syndrome is due to:,,Biology,Mix,Chromosomal disorders,1,Medium,Trisomy of 21st,,Trisomy of 18th,,Extra X chromosome,,Extra Y chromosome,,1
Which succession starts after forest fire of bushy plant?,,Biology,Mix,Ecological succession,1,Medium,Lithosere,,Primary succession,,Secondary succession,,Xerosere,,3
Herbivory in broad sense show:,,Biology,Mix,Plant-animal interactions,1,Medium,Parasitism,,Predation,,Commensalism,,Amensalism,,2
Triple layer cell organelle is:,,Biology,Mix,Organelles,1,Medium,Transosome,,Nucleus,,Mitochondria,,Chloroplast,,4
Lysosome helps in:,,Biology,Mix,Lysosome function,1,Easy,Circulation,,Excretion,,Digestion,,Respiration,,3
"In oligosaccharide, monosaccharides are joined by:",,Biology,Mix,Carbohydrates,1,Medium,Phosphodiester bond,,Peptide bond,,Hydrogen bond,,Glycosidic bond,,4
"If mother have A blood group & father have AB blood group, which blood group isn’t possible?",,Biology,Mix,Blood groups,1,Medium,O,,AB,,A,,B,,1
Ratio of A-T & G-C for human is:,,Biology,Mix,DNA structure,1,Medium,0.88,,1.52,,0.52,,1.88,,2
"DNA is kept in high temperature nearly equal to 90 degree Celsius, then:",,Biology,Mix,DNA denaturation,1,Medium,DNA is broken in two fragments,,DNA is broken in many fragments,,DNA is separated in two strands,,DNA is neither separated nor broken,,3
The interactions between group of organism in a community and their environment:,,Biology,Mix,Community ecology,1,Medium,Synecology,,Autecology,,Community ecology,,Niche,,1
Meiosis is important for:,,Biology,Mix,Cell division,1,Medium,Vegetative propagation,,Sexual reproduction,,Mutation,,Both a and c,,2
Acetyl CoA first react with ___ to form 6C compound.,,Biology,Mix,Krebs cycle,1,Medium,OAA,,Citric acid,,Pyruvic acid,,PGA,,1
Which cellular respiration process gives CO₂?,,Biology,Mix,Respiration stages,1,Medium,Glycolysis & Krebs cycle,,Glycolysis & ETC,,Transition reaction and Krebs cycle,,Transition reaction and ETC,,3
Which type of molecule is an oil?,,Biology,Mix,Lipids,1,Easy,Triglyceride,,Steroid,,Phospholipid,,An amino acid,,1
A homozygous plant having round (R) & yellow (Y) seed is crossed with the homozygous plant having green (r) & wrinkled (y) seed; ratio of yellow & wrinkled in F₂ generation will be:,,Biology,Mix,Dihybrid cross,1,Hard,3/16,,1/15,,1/9,,1/16,,3
Vernalin hormone involved in:,,Biology,Mix,Flowering hormones,1,Medium,Photoperiodism,,Early flowering,,Cell division,,Induce bud dormancy,,2
Solanaceae has swollen:,,Biology,Mix,Ovary & ovule,1,Easy,Ovary,,Placenta,,Ovule,,None,,1
Winged pollen found in:,,Biology,Mix,Pollen grains,1,Easy,Pinus,,Cycas,,Mango,,Dryopteris,,1
Pericarp & placenta both are edible in:,,Biology,Mix,Fruits,1,Medium,Tomato,,Bell peppers,,Apple,,Grapes,,1
Which is used in growth & repair of body?,,Biology,Mix,Nutrients,1,Easy,Protein,,Carbohydrate,,Vitamin,,Mineral,,1
Bacillus thuringiensis is a type of:,,Biology,Mix,Biopesticides,1,Medium,Herbicide,,Insecticide,,Weedicides,,Pesticide,,2
"If there are 20 centromeres in a cell at the mitotic anaphase, then how many chromosomes are there in each daughter cell following cytokinesis?",,Biology,Mix,Mitosis,1,Hard,40,,10,,20,,80,,3
Deficiency of Ascorbic acid causes:,,Biology,Mix,Vitamins,1,Easy,Scurvy,,Pellagra,,Beriberi,,Tetany,,1
Both polyp & medusa are found in which phyla:,,Biology,Mix,Coelenterata,1,Medium,Cnidaria,,Platyhelminthes,,Annelida,,Nematoda,,1
Spongin skeleton is found in:,,Biology,Mix,Porifera,1,Medium,Calcarea,,Hexactinellida,,Demospongiae,,Gastropoda,,3
Chloragogen cell is analogous to:,,Biology,Mix,Annelida,1,Medium,Liver of vertebrate,,Lung of vertebrate,,Kidney of vertebrate,,Brain cell of vertebrate,,1
Which hormone is maximum in luteal phase?,,Biology,Mix,Reproductive hormones,1,Medium,Oestrogen,,Progesterone,,LH,,FSH,,2
"Radula, rasping organ is present in:",,Biology,Mix,Mollusca,1,Medium,Ctenidia,,Tentacles,,Buccal cavity,,Mantle,,3
Which one of these is an arterial disease?,,Biology,Mix,Circulatory diseases,1,Medium,Atherosclerosis,,Arthritis,,Osteoporosis,,Tetany,,1
Which enzyme is present in stomach?,,Biology,Mix,Digestive enzymes,1,Easy,Ptyalin,,Trypsin,,Pepsin,,Rennin,,3
Sensory area is located at:,,Biology,Mix,Brain lobes,1,Easy,Temporal,,Parietal,,Occipital,,Frontal,,2
Finger like modification in auditory system i.e. organ of corti is modified:,,Biology,Mix,Ear,1,Medium,Sensory tissue,,Transitional,,Pseudostratified,,Squamous,,1
Thrust & temperature can be regulated due to effect on:,,Biology,Mix,Endocrine glands,1,Medium,Thyroid,,Pineal,,Hypothalamus,,Parathyroid,,3
Glaucoma is cause due to:,,Biology,Mix,Eye diseases,1,Medium,Intraocular pressure,,Opaque lens,,Uneven curvature of lens,,Shortening of eyeball,,1
Iodopsin of eye used in viewing colour during:,,Biology,Mix,Vision pigments,1,Easy,Morning light,,Bright day,,Night,,Evening,,2
Valium is a type of:,,Biology,Mix,Drugs,1,Medium,Tranquilizer,,Narcotic,,Stimulant,,Hallucinogen,,1
Embryological parallelism:,,Biology,Mix,Embryology,1,Medium,Paleontology,,Recapitulation,,Biogenesis,,Darwinism,,2
Sudden reappearance of ancestral character is:,,Biology,Mix,Atavism,1,Easy,Atavism,,Convergent evolution,,Divergent evolution,,Adaptive radiation,,1
Formation of RBC is called:,,Biology,Mix,Blood,1,Easy,Haematemesis,,Hemoptysis,,Hemopoiesis,,None,,3
The venous system of frog differs from that of mammals in the presence of:,,Biology,Mix,Circulatory system,1,Medium,Hepatic vein system,,Hepatic portal system,,Three superior venacava,,Renal portal system,,4
Which is formed after the destruction of corpus luteum?,,Biology,Mix,Reproduction,1,Medium,Corpus luteum gravidities,,Corpus albicans,,Both,,None,,2
Third eye lid of frog:,,Biology,Mix,Amphibia,1,Easy,Nictitating membrane,,Brow spot,,Choroid,,Tympanum,,1
Waldeyer rings is present in:,,Biology,Mix,Lymphoid organs,1,Medium,Tongue,,Pancreas,,Oropharynx,,Liver,,3
Wings of insect & hollow bones of bird have which type of evolution?,,Biology,Mix,Analogous organs,1,Medium,Convergent,,Divergent,,Atavism,,Adaptive radiation,,1
Which statement is true?,,Biology,Mix,Circulatory system,1,Medium,All artery carry impure blood,,All artery carry impure blood except one,,All vein carry impure blood except one,,All vein carry impure blood,,3
Gambusia fish:,,Biology,Mix,Biological control,1,Easy,Kill adult malarial parasite,,Kills female anopheles,,Feed on larva mosquito,,Feed on adult mosquito,,3
Which of the following epithelium stretches the most?,,Biology,Mix,Epithelial tissue,1,Medium,Cuboidal,,Columnar,,Transitional,,Squamous,,3
The condition in which testes fail to descend in the scrotal sac is called as:,,Biology,Mix,Reproductive system,1,Medium,Minilap,,Crypto-orchidism,,Leprosy,,Vasectomy,,2
Pelvic & pectoral fins are absent in:,,Biology,Mix,Pisces,1,Medium,Hag fish,,Dog fish,,Angle fish,,Silver fish,,1
Larva of Porifera is:,,Biology,Mix,Porifera,1,Medium,Trochophore,,Amphiblastula,,Planula,,Bipinnaria,,2
Alternation of generation is seen in:,,Biology,Mix,Reproduction,1,Medium,Hydra,,Obelia,,Sea horse,,Earthworm,,2
Hyaline cartilage is found in:,,Biology,Mix,Connective tissue,1,Medium,Trachea,,Tip of nose,,Epiglottis,,Eustachian tube,,1
Period of erythrocytic cycle of P. vivax is:,,Biology,Mix,Malaria,1,Medium,14 hr,,36 hr,,48 hr,,24 hr,,3
"Tissue to make framework of lymph node, liver and spleen is:",,Biology,Mix,Connective tissue,1,Medium,Adipose tissue,,Areolar tissue,,Reticular tissue,,Elastic tissue,,3
When a person goes to hospital for check up doctor doesn’t see any pathogenic agent but the pathogen was seen after 3 weeks:,,Biology,Mix,Pathogenesis,1,Hard,Virus was in incubation period,,Virus was in window period,,It is due to Mycobacterium tuberculosis,,It is due to slim disease,,2
Which drug reduces pain?,,Biology,Mix,Analgesics,1,Easy,Hashish,,Opium,,Marijuana,,Charas,,2
Bidders canal take part in:,,Biology,Mix,Frog anatomy,1,Medium,Excretion,,Reproduction,,Urination,,Circulation,,2
Body scale present & absence of tympanum is characteristics of:,,Biology,Mix,Reptiles,1,Medium,Snake,,Ray,,Shark,,Frog,,1
Homo erectus is scientific name of:,,Biology,Mix,Human evolution,1,Medium,Java man,,Peking man,,Java & Peking man,,Neanderthal man,,3
"Person who suddenly meet with an accident reported cardiac, gastro intestine & respiratory problem but doesn’t have much disability with speaking. The likely damage is:",,Biology,Mix,Cranial nerves,1,Hard,Trochlear IV cranial nerve,,Vagus nerve or X cranial nerve,,Optic nerve or II cranial nerve,,Hypoglossal or XII cranial nerve,,2
Earliest form of fossil is:,,Biology,Mix,Fossils,1,Medium,Equus,,Eohippus,,Mesohippus,,Pilohippus,,2
Sprain is cause due to stretching of:,,Biology,Mix,Musculoskeletal system,1,Easy,Tendon,,Ligament,,Bone,,Both a and d,,2
"If A is the mother of B and C is the father of D. A and C are husband-wife. B and D is brother-sister. E is the maternal uncle of B and F is the brother of C. Then, the relation of B to F is:",,MAT,Mix,Blood relation,1,Medium,Uncle,,Niece,,Nephew,,Sister,,3
314865492387351527618565497. The number of odd number preceding and exceeding both by even number is:,,MAT,Mix,Odd-even reasoning,1,Hard,3,,5,,7,,9,,3
"A, B, C, D, E and F are sitting in arrow. C and E at centre and B and F are at the end. A is just left to F. Then, who is sitting right to B?",,MAT,Mix,Sitting order,1,Medium,A,,B,,E,,C,,4
"E J K : 5 10 11, C B E : 3 2 5, A E G : ?",,MAT,Mix,Alphabet reasoning,1,Hard,135,,258,,157,,257,,3
A shopkeeper offers 50% discount on the marked price of Rs. 1000. He got 10% discount on bargaining and then again got 10% discount on scratching coupon. The total discount percent he gained is:,,MAT,Mix,Percentage,1,Medium,55.40%,,59%,,70%,,69%,,2
A person walked 3 km straight forward and bought a flower and then he turned right & walked 4 km ahead. At what distance he/she is from the initial position.,,MAT,Mix,Distance problems,1,Easy,7 km,,5 km,,6 km,,10 km,,3
"In a bus there were certain number of women and men. The number of women is half the number of men. In next bus stop, 5 more women enter the bus while 10 men exit making the number of men and women equal. What is the total number of passengers at initial?",,MAT,Mix,Problem solving,1,Hard,30,,35,,40,,45,,2
"Kiritidhi Bista, Lokendra Chand, Chhabilal Dahal …",,MAT,Mix,Politics of Nepal,1,Easy,KP Oli,,Marchman Singh,,Surya Bahadur Thapa,,Sushil Koirala,,3
"The weight of a calf is 5 kg more than goat. The weight of goat is twice the weight of dog. The total weight of calf, goat and dog is 55 kg. What is the weight of calf?",,MAT,Mix,Problem solving,1,Medium,10 kg,,20 kg,,25 kg,,30 kg,,3
Statements: (i) All good players win. (ii) All good players eat well. Conclusion: (1) All those who eat well are good players. (2) All those who win eat well.,,MAT,Mix,Syllogism,1,Medium,Only conclusion I follows,,Only conclusion II follows,,Either I or II follows,,Neither I nor II follows,,4
"Hari, Ramesh, Mahendra is non-ambitious. Raj, Hari, Krishna is hard working. Ramesh, Mahendra, Krishna is honest. Who is both hard working and non-ambitious?",,MAT,Mix,Puzzle,1,Medium,Raj,,Hari,,Mahendra,,Krishna,,2
"SOUL = 67, STOP = 70, FOUL = ?",,MAT,Mix,Word coding,1,Hard,80,,72,,49,,54,,2
"A is taller than B and C is taller than D. If B is not shorter than C, then who is the tallest?",,MAT,Mix,Comparison reasoning,1,Medium,B,,C,,D,,A,,2
"A boy is 10 years old, and his sister is half his age. In how many years will his sister be 12 years old?",,MAT,Mix,Age problems,1,Easy,4 years,,6 years,,7 years,,8 years,,3
Which is the largest invertebrate?,,Zoology,Mix,Mollusca,1,Medium,Sepia,,Octopus,,Giant squid,,Loligo,,3
Which of the following is not a true amphibian?,,Zoology,Mix,Classification,1,Easy,Salamander,,Toad,,Frog,,Tortoise,,4
Archaeopteryx is a connecting link between:,,Zoology,Mix,Fossil evidence,1,Medium,Mammal and amphibian,,Amphibians and reptiles,,Reptiles and mammals,,Reptiles and birds,,4
Which of the following is not the feature of echinoderms?,,Zoology,Mix,General characters,1,Medium,Pedicellariae,,Fresh water,,Water vascular system,,Tube feet,,2
Which canal system is found in larva of demospongiae?,,Zoology,Mix,Canal system,1,Medium,Ascon,,Sycon,,Leucon,,Raghon,,3
Tree frog is:,,Zoology,Mix,Frog species,1,Easy,Hyla,,Toad,,Rhacophorus,,Phrynosoma,,3
Ospharadium is present in:,,Zoology,Mix,Sense organs,1,Medium,Mollusca,,Annelida,,Platyhelminthes,,Echinodermata,,1
Tendons and ligaments are:,,Zoology,Mix,Connective tissue,1,Medium,Loose connective tissue,,Dense connective tissue,,Epithelial tissue,,Muscular tissue,,2
Insulin is produced by:,,Zoology,Mix,Pancreatic hormones,1,Easy,α cells,,β cells,,δ cells,,G cells,,2
Blood vessel is internally lined by:,,Zoology,Mix,Circulatory system,1,Medium,Mesothelium,,Tunica adventitia,,Endothelium,,Tunica media,,3
Transitional epithelium is found in:,,Zoology,Mix,Epithelial tissue,1,Medium,Liver,,Urinary bladder,,Esophagus,,Trachea,,2
Pleura is a covering of:,,Zoology,Mix,Respiratory system,1,Medium,Heart,,Spleen,,Lungs,,Liver,,3
Angiotensinogen is converted into angiotensin by:,,Zoology,Mix,Renin-angiotensin system,1,Medium,Androgen,,Aldosterone,,ACE,,Renin,,3
The shape of (HbO₂) oxyhemoglobin dissociation curve is:,,Zoology,Mix,Hemoglobin,1,Medium,Sigmoid,,J-shaped,,Hyperbola,,Parabola,,1
Red blood cells of frogs are:,,Zoology,Mix,Blood,1,Easy,Biconvex and nucleated,,Biconvex and anucleated,,Biconcave and nucleated,,Biconcave and anucleated,,3
Rhabdites is found in:,,Zoology,Mix,Organs,1,Medium,Mollusca,,Annelida,,Platyhelminthes,,Nemathelminthes,,3
Cuticle lines the innermost layer of earthworm in:,,Zoology,Mix,Digestive system,1,Medium,Pharynx,,Gizzard,,Intestine,,Stomach,,3
True coelom is found in:,,Zoology,Mix,Body cavity,1,Medium,Ascaris,,Earthworm,,Porifera,,Hydra,,2
P wave in ECG shows:,,Zoology,Mix,ECG,1,Easy,Ventricular depolarization,,Atrial depolarization,,Ventricular repolarization,,Atrial repolarization,,2
Mycobacterium causes,,Zoology,Mix,Pathogens,1,Easy,Tuberculosis,,Typhoid,,AIDS,,Giardiasis,,1
Hypoglycemia refers to:,,Zoology,Mix,Blood sugar,1,Easy,Low blood sugar level,,Genetic defect,,Chromosomal defect,,High blood sugar level,,1
Malaria parasite is:,,Zoology,Mix,Plasmodium,1,Easy,Monogenetic,,Digenetic,,Dimorphic,,Trimorphic,,2
Brown colour of earthworm is due to:,,Zoology,Mix,Earthworm,1,Easy,Porphyrin,,Cuticle,,Melanin,,Hemoglobin,,3
Function of malleus is:,,Zoology,Mix,Ear ossicles,1,Medium,Sound amplification,,Hearing,,Balancing,,Dynamic equilibrium,,1
The function of kidney is:,,Zoology,Mix,Excretion,1,Medium,Remove fecal matter,,Remove metabolic waste and excess water,,Regulation of fats,,Metabolize drugs,,2
Which is a correct pair?,,Zoology,Mix,Diseases,1,Medium,Paramecium – Surra disease,,Leishmania – Sleeping sickness,,Trypanosoma – Elephantiasis,,Female Anopheles – Malaria,,4
Oligochaeta is found in:,,Zoology,Mix,Classification,1,Easy,Arthropoda,,Echinodermata,,Annelida,,Mollusca,,3
"When a frog in water of 27°C is taken to 32°C, what will be temperature of the frog?",,Zoology,Mix,Frog physiology,1,Medium,32°C,,27°C,,Less than 27°C,,More than 32°C,,1
Amoeba locomotes because of:,,Zoology,Mix,Amoeba,1,Medium,Cilia,,Change in viscosity,,Flagella,,Tentacles,,2
HIV invades:,,Zoology,Mix,Immune system,1,Medium,T-lymphocytes,,B-lymphocytes,,Erythrocytes,,Thrombocytes,,1
Sperms move by:,,Zoology,Mix,Reproduction,1,Easy,Tail,,Acrosome,,Middle piece,,Head,,1
Aldosterone is secreted by:,,Zoology,Mix,Hormones,1,Medium,Pancreas,,Thyroid,,Adrenal gland,,Pituitary gland,,3
"Which part of brain is responsible for thinking, recalling and learning?",,Zoology,Mix,Brain,1,Medium,Hippocampus,,Corpora quadrigemina,,Cerebrum,,Cerebellum,,3
Frogs vasa efferentia is connected to:,,Zoology,Mix,Reproductive system,1,Medium,Bidder’s canal,,Testes,,Rete testis,,Seminal vesicle,,2
The prolonged effect of smoking is:,,Zoology,Mix,Smoking diseases,1,Medium,Emphysema,,Encephalopathy,,Wernicke–Karsakoff syndrome,,Hodgkin disease,,1
If the level of iodine is decreased in tadpole:,,Zoology,Mix,Metamorphosis,1,Medium,Metamorphosis increases,,Metamorphosis decreases,,Tadpole remain as it is,,Metamorphosis cannot stand tadpole,,2
Malaria parasite is:,,Zoology,Mix,Plasmodium,1,Easy,Paramecium,,Plasmodium,,Trypanosoma,,Leishmania,,2
The poisonous substance released in the blood of human is:,,Zoology,Mix,Blood,1,Medium,Hematin,,Hemozoin,,Globin,,Hirudin,,2
Indirect development includes larval stages. Which of the following has direct development?,,Zoology,Mix,Development,1,Medium,Hydra,,Dugesia,,Sycon,,Mollusca,,2
Chelicerae are found in:,,Zoology,Mix,Mouth parts,1,Medium,Spider,,Prawn,,Housefly,,Lepisma,,1
How many mitosis division forms 512 cells?,,Botany,Mix,Mitosis,1,Medium,9,,8,,6,,7,,2
Glycolysis occurs in:,,Botany,Mix,Glycolysis,1,Medium,Mitochondria,,Cytoplasm,,Chloroplast,,Endoplasmic reticulum,,2
Protein present in nucleic acid is:,,Botany,Biomolecules,Proteins & nucleic acids,1,Medium,Albumin,,Globulin,,Histone,,Globin,,3
Most stable ecosystem is:,,Botany,Ecology,Ecosystems,1,Easy,Pond,,Forest,,Desert,,Ocean,,2
Reticulate chloroplast is found in:,,Botany,Algae,Chloroplast types,1,Medium,Ulothrix,,Spirogyra,,Oedogonium,,Chlamydomonas,,2
Sickle cell anemia is related with:,,Botany,Genetics,Genetic disorders,1,Medium,Point mutation,,Chromosomal aberration,,Aneuploidy,,Polyploidy,,1
Modified stem for storage and perennation found in:,,Botany,Morphology,Modified stems,1,Easy,Ginger,,Radish,,Ground nut,,Turnip,,1
Process of formation of DNA from RNA is:,,Botany,Genetics,Central dogma,1,Medium,Translation,,Transcription,,Reverse Transcription,,Replication,,3
Ribosome in eukaryotes is:,,Botany,Cell Biology,Ribosome types,1,Medium,70s,,80s,,60s,,50s,,2
