question_text,question_image_url,course_name,chapter,Topic,marks,difficulty,option_1,option_1_image_url,option_2,option_2_image_url,option_3,option_3_image_url,option_4,option_4_image_url,answer_option_number
Defensive organ of paramecium is,,Zoology,Zoology,Protozoa,1,Easy,Trichocyst,,Nematocyst,,Cytopyge,,Cilia,,1
Infective stage of Plasmodium is,,Zoology,Microbiology,Malaria,1,Easy,Trophozoites,,Sporozoites,,Cryptozoites,,Merozoites,,2
Skeleton and Muscles both develop from,,Zoology,Embryology,Germ layers,1,Easy,Mesoderm and Ectoderm,,Ectoderm only,,Ectoderm and Endoderm,,Mesoderm only,,4
During gastrula frogs embryo is differentiated into,,Zoology,Embryology,Gastrulation,1,Easy,Ectoderm and Endoderm,,Ectoderm only,,Endoderm only,,"Ectoderm, Mesoderm and Endoderm",,4
Eustachian tube connects,,Zoology,Anatomy,Ear,1,Easy,Middle ear and Pharynx,,Internal ear and Pharynx,,Middle ear and Internal ear,,External ear and Middle ear,,1
Tailed frog and Toad belongs to,,Zoology,Zoology,Amphibians,1,Easy,Anura,,Apoda,,Parasipida,,Urodela,,4
Common in Paramecium and Plasmodium is,,Zoology,Zoology,Protozoa,1,Medium,Mode of nutrition,,Locomotary organ,,Reproduction by fission,,Habit,,3
Fish that migrate from fresh water to sea water are,,Zoology,Zoology,Fishes,1,Easy,Catadromous,,Anadromous,,Amphidromous,,Ocenodromous,,1
Deltoid ridge is present in,,Zoology,Anatomy,Skeletal system,1,Easy,Femur,,Humerus,,Tibia-fibula,,Ulna,,2
Endangered species according to '1973 act of government of Nepal' is,,Zoology,Zoology,Endangered species,1,Easy,Red deer,,Swamp deer,,Spotted deer,,Hog deer,,2
Polymorphism is observed in,,Zoology,Zoology,Polymorphism,1,Easy,Porifera,,Coelenterates,,Mollusca,,Echinodermata,,2
Larvae are motile and adult sedentary in,,Zoology,Zoology,Life cycle,1,Easy,Protozoa,,Porifera,,Coelenterate,,Arthropoda,,3
Thermoregulatory center is located in,,Zoology,Human Physiology,Nervous system,1,Easy,Optic lobe,,Thymus gland,,Medulla oblongata,,Hypothalamus,,4
Male genital aperture in Earthworm is found in,,Zoology,Zoology,Earthworm,1,Easy,14th segment,,17th segment,,18th segment,,19th segment,,2
Which of the following helps in the nourishment of sperm?,,Zoology,Zoology,Reproduction,1,Easy,Leydig cell,,Rete testis,,Bartholin’s gland,,Sertoli cell,,4
Chikengunia fever is caused by,,Zoology,Microbiology,Diseases,1,Easy,Culex,,Anopheles,,Aedes,,Mansonia,,3
Meibomian gland is found in,,Zoology,Human Anatomy,Glands,1,Easy,Ear,,Pharynx,,Eye,,Nose,,3
Farsightedness (age >55 years) is due to,,Zoology,Human Anatomy,Eye defects,1,Medium,Myopia,,Hypermetropia,,Astigmatism,,Presbyopia,,4
Intercalated disc are found in,,Zoology,Zoology,Muscle tissue,1,Medium,Skeletal muscle,,Cardiac muscle,,Involuntary muscle,,All of these,,2
Which of the following bone is not included under axial skeleton?,,Zoology,Zoology,Skeletal system,1,Medium,Skull,,Pectoral girdle,,Vertebral column,,Ribs,,2
Which of the following leucocyte doesn’t contain granules in cytoplasm?,,Zoology,Cytology,WBC,1,Medium,Neutrophil,,Basophil,,Monocyte,,Eosinophil,,3
Which of the following tissue is also known as “pavement epithelium”?,,Zoology,Zoology,Epithelial tissue,1,Easy,Columnar epithelium,,Cuboidal epithelium,,Ciliated epithelium,,Simple squamous epithelium,,4
Salmonella typhi mainly affects,,Zoology,Microbiology,Typhoid,1,Easy,Large intestine,,Liver,,Ileum,,Duodenum,,3
The gland mainly responsible for calcium homeostasis is,,Zoology,Human Physiology,Endocrine glands,1,Medium,Thymus,,Thyroid,,Parathyroid,,Adrenal,,3
Bile is secreted by,,Zoology,Human Physiology,Digestive system,1,Easy,Gall bladder,,Intestine,,Liver,,Kidneys,,3
Wings of bird and insect represents,,Zoology,Evolution,Analogous organs,1,Easy,Analogous organ,,Homologous organ,,Atavism,,Vestigial organ,,1
What does pulse measure?,,Zoology,Human Physiology,Circulation,1,Easy,Magnitude of heart beat,,Force of heart beat,,Rhythm of heart beat,,Number of heart beat,,4
Which of the following forms left the coloured cave painting?,,Zoology,Evolution,Human evolution,1,Medium,Neanderthal man,,Cro-Magnon man,,Java man,,Peeking man,,2
The calciferous glands in earthworm are found in,,Zoology,Zoology,Earthworm,1,Easy,Buccal,,Gizzard,,Stomach,,Intestine,,4
During gastrulation embryo of vertebrate is differentiated into,,Zoology,Embryology,Gastrulation,1,Medium,Ectoderm and Endoderm,,Ectoderm and Mesoderm,,"Ectoderm, Endoderm and Mesoderm",,Endoderm and Mesoderm,,3
The people wear clothing that covers large area of their skin. They are at risk of a deficiency of the sunlight in the short supply. Which nutrient do they lack?,,Zoology,Nutrition,Vitamins,1,Medium,Calcium,,Vitamin D,,Iron,,Vitamin C,,2
Socket in pelvic girdle in which head of femur articulates is formed by the fusion of,,Zoology,Anatomy,Pelvic girdle,1,Medium,Ischium and pubis,,Ilium and pubis,,Ilium and ischium,,"Ilium, ischium and pubis",,4
Which of the following is a pearl secreting group?,,Zoology,Zoology,Mollusca,1,Easy,Mollusca,,Coelenterata,,Porifera,,Echinodermata,,1
Typical cross-pollination is found in,,Botany,Botany,Pollination,1,Easy,Rice,,Maize,,Pumpkin,,Wheat,,2
Leafy stipules are present in,,Botany,Botany,Morphology,1,Easy,Mustard,,Lathyrus,,Cotton,,Chrysanthemum,,2
Nicotine belongs to the family,,Botany,Botany,Plant families,1,Easy,Solanaceae,,Cruciferae,,Papilionaceae,,Liliaceae,,1
Vascular cryptogams are,,Botany,Botany,Plant classification,1,Easy,Bryophytes,,Pteridophytes,,Gymnosperms,,Angiosperms,,2
Total stem parasite is,,Botany,Botany,Parasitic plants,1,Medium,Cuscuta,,Loranthus,,Pitcher plant,,Rafflesia,,1
Most common type of ovule in angiosperm is,,Botany,Botany,Ovule types,1,Medium,Orthotropous,,Anatropous,,Campylotropous,,Amphitropous,,2
Total sum of genes in a population is,,Botany,Genetics,Gene pool,1,Easy,Gene pool,,Genome,,Cistron,,Recon,,1
Fermentation of pyruvic acid into carbon dioxide and water occurs in,,Botany,Biochemistry,Respiration,1,Medium,Glyoxylate cycle,,Fermentation,,Krebs cycle,,Golgi cycle,,3
In DNA the complementary bases are:,,Botany,Genetics,Base pairing,1,Easy,"Adenine and thymine, guanine and cytosine",,"Uracil and adenine, cytosine and guanine",,"Adenine and guanine, thymine and cytosine",,"Adenine and thymine, guanine and uracil",,1
Ovary is absent in,,Botany,Botany,Plant anatomy,1,Easy,Gymnosperm,,Angiosperm,,Both,,None,,1
First process in food chain in ecosystem is,,Botany,Ecology,Food chain,1,Easy,Photosynthesis,,Decay,,Respiration,,Consumer,,1
The most poisonous Fungus is,,Botany,Botany,Fungi,1,Easy,Amanita,,Albugo,,Morchella,,Pythium,,1
Meiosis occurs in,,Botany,Botany,Cell division,1,Medium,Pollen grain,,Tapetal cell,,Root tip,,Endosperm,,1
Formation of sporophyte from gametophytic tissue is,,Botany,Botany,Reproduction,1,Medium,Apogamy,,Apospory,,Parthenogenesis,,Diplospory,,1
Golgi-complex helps in the formation of,,Botany,Cytology,Cell organelles,1,Easy,Zymogen,,Protein,,Spindle fiber,,Carbohydrate,,4
Sudden change in the gene is due to,,Botany,Genetics,Mutation,1,Easy,Mutation,,Crossing over,,Translocation,,Translation,,1
Epilepsy is controlled by,,Botany,Botany,Lichens,1,Medium,Peltigera,,Usnea,,Parmelia,,Rocella tinctoria,,2
Plant Aloe vera stores water during rainy season and use it during drought season. This process in plant is called,,Botany,Botany,Adaptation,1,Medium,Drought avoiding,,Drought evading,,Drought escaping,,Succession,,2
"Person or animal with colorless skin, eyes and hair are called:",,Botany,Zoology,Genetics,1,Easy,Albido,,Alnino,,Albino,,Algid,,3
Bio-fertilizer in crop is improved by supplementing,,Botany,Botany,Biofertilizer,1,Easy,Phosphate fertilizer,,Nitrogen fertilizer,,Urea,,Calcium fertilizer,,2
Co-inheritance of gene in same chromosome is,,Botany,Genetics,Linkage,1,Medium,Linkage,,Crossing over,,Epistasis,,Allele,,1
The term cell was first used by,,Botany,Cytology,Cell theory,1,Easy,Schleiden,,Robert Hooke,,Schwann,,Annelida,,2
An aerobic bacteria found commonly in intestine is,,Botany,Microbiology,Intestinal bacteria,1,Easy,Escherichia coli,,Streptococcus,,Vibrio,,Bacillus,,1
Type of inflorescence in which cluster of flowers appear inside cavity is,,Botany,Botany,Inflorescence,1,Easy,Cyathium,,Verticillaster,,Hypanthodium,,Capitulum,,3
Root pressure is maximum when,,Botany,Plant Physiology,Root pressure,1,Medium,Transpiration is low and absorption is high,,Transpiration is low and absorption is low,,Transpiration high and absorption is low,,Transpiration and absorption both are high,,3
Krebs cycle occurs in,,Botany,Biochemistry,Respiration,1,Easy,Nucleus,,Chloroplast,,Mitochondria,,Cytoplasm,,3
Abscisic acid (ABA) is a plant growth hormone involved in,,Botany,Plant Physiology,Plant hormones,1,Medium,Shoot elongation,,Root elongation,,Dormancy of seed,,Increased cell division,,3
A boy with Klinefelter’s syndrome has,,Botany,Genetics,Chromosomal disorders,1,Medium,46 (XY),,44 (XX),,45 (X0),,47 (XXY),,4
Association of algae and fungi to form lichen is called,,Botany,Botany,Lichens,1,Easy,Symbiosis,,Parasitism,,Commensalism,,Saprophytic,,1
Organic acid found in the cell wall of bacteria is,,Botany,Microbiology,Bacteria,1,Easy,Oxaloacetic acid,,Muramic acid,,Salicylic acid,,Pyruvic acid,,2
Passage cells and casparian strips of suberin are found in,,Botany,Botany,Root anatomy,1,Medium,Epidermis,,Endodermis,,Pericycle,,Cortex,,2
In which stage of mitosis do chromatids of each chromosome separate and move towards the poles of the spindle?,,Botany,Cytology,Mitosis,1,Medium,Prophase,,Metaphase,,Anaphase,,Telophase,,3
Vascular bundles in dicot stem are,,Botany,Botany,Stem anatomy,1,Medium,"Open, collateral, endarch",,"Open, collateral, exarch",,"Closed, collateral, endarch",,"Closed, collateral, exarch",,1
Floridean starch occurs in,,Botany,Botany,Algae,1,Easy,Myxophyceae,,Rhodophyceae,,Chlorophyceae,,Phaeophyceae,,2
Organisms were classified into plants and animals for the first time by,,Botany,Taxonomy,Classification,1,Easy,Aristotle,,E. Haeckel,,John Ray,,Linnaeus,,1
The part of chromosome taking part in crossing over is,,Botany,Genetics,Chromosome,1,Medium,Cistron,,Recon,,Muton,,Operon,,2
Movement of plant in response of touch is,,Botany,Plant Physiology,Tropism,1,Easy,Thigmonastic,,Thermonastic,,Sismonastic,,Phototropic,,1
Antibiotics fail to act on virus because,,Botany,Microbiology,Viruses,1,Easy,They multiply only inside cells of the bacteria,,They have no metabolism of their cells,,They have thick protein coat called capsid,,They are obligate intracellular,,2
Energy stored in an ecosystem can be explained by,,Botany,Ecology,Food chain,1,Medium,Trophic levels,,Food web,,Food chain,,Pyramid of Biomass,,4
Translator mechanism for pollination is present in,,Botany,Botany,Pollination,1,Medium,Ficus,,Moringa,,Musa,,Agave,,1
How much lead of sp. gr. 11 should be added to a piece of fork sp. gr. 0.2 weighing 10 gm. so that it may just float in water?,,Physics,Mechanics,Buoyancy,1,Hard,10 g,,20 g,,44 g,,50 g,,3
Two parallel square plates of length 10 cm and moving with velocity 10 cm/sec pass in liquid of viscosity 0.01 poise. If the force between the plates in liquid is 200 dyne then the separation between the plates is,,Physics,Fluid Mechanics,Viscosity,1,Hard,5 cm,,0.5 cm,,0.05 cm,,0.005 cm,,3
An object is placed at distance of 40 cm in front of a concave mirror having focal length 20 cm. What type of image is formed?,,Physics,Optics,Concave mirror,1,Easy,Real and erect,,Virtual and inverted,,"Real, inverted and same size",,Real and virtual,,3
"A body travels one third of distance with 10 km/hr, another one third with 20 km/hr and remaining one third with 60 km/hr then average speed is",,Physics,Mechanics,Average speed,1,Medium,12 km/hr,,16 km/hr,,18 km/hr,,32 km/hr,,3
If the mass of earth is 6 × 10²⁴ kg and escape velocity of earth is equal to velocity of light then radius of earth is,,Physics,Gravitation,Escape velocity,1,Hard,200 cm,,6.4 × 10⁶ m,,9 mm,,400 km,,2
What is the average power of refrigerator consumed when 263 J of energy is transfer through –10°C to 25°C?,,Physics,Thermodynamics,Refrigerator,1,Medium,10 Watt,,35 Watt,,40 Watt,,50 Watt,,2
"The temperature of source is 500K with source energy 200J, what is the temperature of sink with sink energy 100J?",,Physics,Thermodynamics,Heat engine,1,Medium,500 K,,250 K,,125 K,,100 K,,2
The deviation produced by a prism doesn’t depend on,,Physics,Optics,Prism,1,Easy,Angle of prism,,Material of prism,,The angle of incidence,,Size of the prism,,4
‘C’ and ‘S’ are the coefficient of apparent expansion of copper and silver respectively. The coefficient of linear expansion of copper is A then that of silver is,,Physics,Heat,Expansion,1,Hard,(C – 3A + S)/3,,(C – 3A – S)/3,,(C + 3A + S)/3,,(C + 3A – S)/3,,1
8 small drop of capacitance and radius ‘r’ combines to form a big drop of radius R then the capacitance of big drop will be,,Physics,Electrostatics,Capacitor,1,Hard,2C,,4C,,8C,,16C,,4
25 tuning forks are arranged in series with decreasing frequency 3 beats/sec. If the frequency of first tuning fork is octave of the last then the frequency of 1st tuning fork is,,Physics,Waves,Beats,1,Hard,142,,144,,146,,140,,3
The temperature of dew formation was 4.6°C and the temperature of dew was 5.4°C. The atmospheric temperature is 20°C. The relative humidity is (given S.V.P of water at 5°C = 6.5 mm and at 20°C = 17.5 mm),,Physics,Thermodynamics,Humidity,1,Hard,20%,,37%,,67%,,80%,,3
"5 cells each of emf ‘E’ and internal resistance ‘r’ are connected in series, by mistake one of the cell was connected wrongly then equivalent emf and internal resistance will be",,Physics,Electricity,Cells in series,1,Hard,"5E, 5r",,"3E, 5r",,"3E, 3r",,"3E, 2r",,2
"The half-life of a radioactive substance is 2 months, then the amount of substance left after 1 year is",,Physics,Radioactivity,Half-life,1,Medium,M/64,,M/32,,M/16,,M/8,,1
The elasticity of highly elastic body is,,Physics,Properties of Matter,Elasticity,1,Easy,0.3,,0.5,,0.8,,1,,4
"If an object of mass ‘m’ moving in circular path with uniform velocity ‘v’, which of the following change occurs in half circle.",,Physics,Mechanics,Circular motion,1,Hard,Kinetic energy changes by mv²/2,,Kinetic energy changes by mv²/4,,Momentum changes by 2mv,,Momentum doesn’t change,,3
If a photon has 100ev energy then its frequency is,,Physics,Modern Physics,Photon energy,1,Hard,2.5 × 10⁸,,2.5 × 10¹⁶,,2.5 × 10²⁴,,2.5 × 10³²,,2
A wire of mass 200 kg has capacitance 0.0014 μF/kg and frequency 500 KHz. Then what is the inductance when impedance is minimum?,,Physics,Electricity & Magnetism,LC circuit,1,Hard,0.3,,0.37,,0.477,,0.5,,2
"Two mirrors A and B are inclined at angle θ. A ray of light incident in mirrors B is deviated to 62° and the angle of emergence is 20°, then find the angle of inclination.",,Physics,Optics,Mirrors,1,Hard,20°,,30°,,40°,,50°,,3
Sound wave in rocks are:,,Physics,Waves,Sound waves,1,Medium,Longitudinal stationary,,Transverse stationary wave,,Longitudinal and transverse wave,,Wave in rock does not propagate,,3
The energy gap between the conduction band and the valance band of a certain material is 0.7 eV. The material is,,Physics,Semiconductors,Energy band gap,1,Medium,An insulator,,A conductor,,Semiconductor,,Semimetal,,3
If an automobile moves with constant power ‘P’ relation between velocity and time will be,,Physics,Mechanics,Power,1,Medium,v ∝ t¹ᐟ²,,v ∝ t³ᐟ²,,v ∝ t²,,v ∝ t,,1
NC-1 has the same dimension as,,Physics,Units & Dimensions,Dimensional analysis,1,Easy,Volt meter,,Farad meter,,Candela,,Volt/meter,,4
Two spheres of same material have their radii in the ratio 1:2. Moment of inertia about their axes will be in the ratio,,Physics,Rotational Motion,Moment of inertia,1,Medium,1:2,,1:4,,01:16,,01:32,,2
F = 6πnrυ is the expression of,,Physics,Fluid Mechanics,Stoke’s law,1,Medium,Equation of continuity,,Bernoulli’s theorem,,Torricelli’s theorem,,Stokes law,,4
Emf induced in a rod moving in a magnetic field ‘B’ with a velocity ‘v’ making an angle θ with B is,,Physics,Electromagnetism,Electromagnetic induction,1,Medium,Bvl sinθ,,Bvl cosθ,,Bv²,,½ Bv²l,,1
Fuse wire should have,,Physics,Electricity,Fuse,1,Easy,"High resistivity, low melting point",,High resistivity and high melting point,,"Low resistivity, high melting point",,Low resistivity and melting point,,1
The deviation produced by a prism is maximum for,,Physics,Optics,Prism deviation,1,Easy,Red,,Indigo,,Blue,,Green,,3
A coil when connected with 200 V mains dissipates 400 watts. The resistance of the coil is … ohm.,,Physics,Electricity,Resistance,1,Medium,10,,100,,0.5,,2,,2
"When a semi-conductor is heated, its resistance",,Physics,Semiconductors,Resistance,1,Easy,Decreases,,Increases,,Remains the same,,May increase or decrease depending upon the semi-conductor,,1
The ratio of charge to mass ratio of proton to α-particle equals,,Physics,Atomic Physics,Charge to mass ratio,1,Medium,2,,4,,½,,¼,,1
The half life of Radium is 1600 years. What is the fraction of sample remaining after 6400 years?,,Physics,Radioactivity,Half-life,1,Medium,1/64,,1/4,,1/256,,1/16,,2
The unit of electrical conductivity is,,Physics,Electricity,Conductivity,1,Easy,Ohm-m,,Ohm/m,,Ohm⁻¹ meter,,(Ohm-meter)⁻¹,,4
A rectifier converts,,Physics,Electronics,Rectifier,1,Medium,AC into DC,,DC into AC,,AC into AC,,DC into DC,,1
Which of the following is a scalar quantity?,,Physics,Mechanics,Scalars & vectors,1,Easy,Electric field,,Electrostatic potential,,Angular moment,,Torque,,2
A satellite is orbiting close to earth surface then its orbital speed is,,Physics,Gravitation,Satellites,1,Medium,√2Rg,,√Rg,,√(Rg/2),,(Rg)²,,2
The light of coherent source have same:,,Physics,Optics,Wave theory,1,Easy,Frequency,,Amplitude,,Phase,,None,,3
Two particles of equal masses are revolving in circular paths of radii r₁ and r₂ respectively with same speed. The ratio of their centripetal forces is,,Physics,Mechanics,Circular motion,1,Medium,r₂/r₁,,r₁/r₂,,(r₁/r₂)²,,(r₂/r₁)²,,1
Eye piece of Galilean Telescope consists of,,Physics,Optics,Telescope,1,Medium,Convex lens,,Concave lens,,Planoconcave,,Cylindrical,,2
"During forward biasing, thickness of depletion layer",,Physics,Semiconductors,PN junction,1,Easy,Decreases,,Increases,,May increase and decrease,,Remains constant,,1
The rate of radiation of a black body at a certain temperature is E joule/sec. When its temperature is doubled the rate of radiation will be,,Physics,Thermodynamics,Black body radiation,1,Medium,E,,4E,,8E,,16E,,4
"On a particular day relative humidity is 100% and the room temperature is 30°C, then dew point is",,Physics,Thermodynamics,Humidity,1,Easy,70°C,,30°C,,100°C,,0°C,,2
"If the speed of light were 2/3 of its present value, the energy released in a given atomic explosion would",,Physics,Modern Physics,Atomic energy,1,Medium,Decreases by factor 3/2,,Decreases by factor 9/4,,Decreases by factor 9/2,,Remains unchanged,,2
Energy is not carried by,,Physics,Waves,Types of waves,1,Easy,Longitudinal wave,,Transverse wave,,Electromagnetic wave,,Stationary wave,,4
The speed of light in a medium of refractive index 2 will be,,Physics,Optics,Refractive index,1,Easy,3×10⁸ m/s,,1.5×10⁸ m/s,,2×10⁸ m/s,,6×10⁸ m/s,,2
A convex lens of focal length 0.5 m and concave lens of focal length 1 m are combined. The power of the resulting lens will be,,Physics,Optics,Lens combination,1,Medium,1 D,,–1 D,,0.5 D,,–0.5 D,,3
The energy stored in a capacitor of capacitance ‘C’ and potential V is given by,,Physics,Electricity,Capacitor,1,Medium,½ CV²,,½ C²V,,½ C²V²,,½ CV,,1
Unit of magnetic field induction B is,,Physics,Magnetism,Units,1,Easy,Weber,,Newton/cons,,Tesla,,Weber-m²,,3
At a place the vertical and horizontal component of earth’s magnetic field are equal. The angle of dip at that place is,,Physics,Magnetism,Earth’s magnetism,1,Easy,30°,,45°,,60°,,90°,,2
Cathode rays are,,Physics,Modern Physics,Cathode rays,1,Easy,Stream of electrons,,Stream of protons,,Stream of α-particle,,Stream of neutrons,,1
The product formed when Sodium methoxide is boiled with chloroethane is,,Chemistry,Organic Chemistry,Alcohols,1,Medium,Propane,,Methyl ethyl ether,,Ethyl alcohol,,Propyl alcohol,,2
Tautomerism is shown by,,Chemistry,Organic Chemistry,Isomerism,1,Medium,Exchange of electron between two atoms,,Exchange of proton between two atoms,,Exchange of ions between two atoms,,Existence of keto and enol form,,4
Hydrated Alumina is converted to anhydrous form by,,Chemistry,Inorganic Chemistry,Metallurgy,1,Easy,Roasting,,Calcination,,Smelting,,Leaching,,2
6 g of Carbon is completely oxidized to carbon dioxide then amount of carbon dioxide liberated at NTP is,,Chemistry,Inorganic Chemistry,Chemical reaction,1,Medium,22.4 Lt,,11.2 Lt,,5.6 Lt,,4.48 Lt,,2
"75% of substance decays in 32 min, then 50% decays in",,Chemistry,Nuclear Chemistry,Radioactivity,1,Medium,24 min,,16 min,,8 min,,32 min,,2
"N₂ + 3H₂ → 2NH₃ (ΔH = –92 kcal), the reaction proceed forward by",,Chemistry,Thermodynamics,Haber process,1,Medium,High temperature high pressure,,Low temperature high pressure,,High temperature and low pressure,,Low temperature low pressure,,2
Aromatic acidic hydrocarbon among the following is,,Chemistry,Organic Chemistry,Aromatic compounds,1,Medium,Phenol,,Carboxylic acid,,Methanol,,Acetaldehyde,,1
Mixture of Ethyne and Ethene is separated by,,Chemistry,Organic Chemistry,Hydrocarbons,1,Medium,Alk. KMnO₄,,Ammoniacal AgNO₃,,Bromine water,,KCN,,2
"Zn reacts with potassium nitrate in alkaline medium, the compound formed is",,Chemistry,Inorganic Chemistry,Redox,1,Medium,N₂,,N₂O,,NO,,NH₃,,2
Which of the following doesn’t give haloform test?,,Chemistry,Organic Chemistry,Haloform test,1,Easy,Ketone,,Ethanol,,Ethanal,,Ethane,,4
Which of the following allotrope of phosphorus doesn’t exist?,,Chemistry,Inorganic Chemistry,Phosphorus,1,Easy,Red,,Yellow,,Black,,Green,,4
Real gas changes to ideal gas at,,Chemistry,Physical Chemistry,Gas laws,1,Medium,Boyle’s temperature,,Critical temperature,,Charles’ temperature,,Inversion temperature,,1
"Rate of reaction (R) = K[A]ᵃ[B]ᵇ, if the concentration of both A and B is doubled, rate increases by 8-times and if concentration of B is increased, rate increases by 2-times then the order of reaction is",,Chemistry,Chemical Kinetics,Rate law,1,Hard,2,,1,,4,,3,,4
Non metals are,,Chemistry,General Chemistry,Metals & Nonmetals,1,Easy,Malleable,,Solid,,Ductile,,Brittle,,4
If the radius of 1st Bohr orbit is 2a then the radius of 3rd orbit is,,Chemistry,Atomic Structure,Bohr model,1,Medium,9a,,18a,,27a,,3a,,3
Which of the following hybridization is present in propene?,,Chemistry,Organic Chemistry,Hybridization,1,Medium,sp³,,sp²,,sp-sp²,,sp²-sp³,,2
Which of the following doesn’t displace hydrogen?,,Chemistry,Inorganic Chemistry,Metals,1,Medium,Pb,,Sn,,Hg,,Al,,3
The delocalization of electron that occurs through sigma bond in the orbital is,,Chemistry,Organic Chemistry,Effects,1,Hard,Inductive effect,,Hyper-conjugation,,Electromeric effect,,Mesomeric effect,,2
Which of the following is weak acid?,,Chemistry,Organic Chemistry,Acids,1,Easy,Methanoic acid,,Ethanoic acid,,Butanoic acid,,Propanoic acid,,4
"Identification of 1°, 2° and 3° alcohol can be done by",,Chemistry,Organic Chemistry,Alcohol tests,1,Medium,Lucas reagent,,Heisenberg reagent,,Hoffmann’s reagent,,Nessler’s reagent,,1
25 mole of hydrogen reacts with 18 mole of iodine. At equilibrium 30.8 mole of HI is formed. Then the percentage degree of dissociation of HI is,,Chemistry,Physical Chemistry,Equilibrium,1,Hard,18%,,24.50%,,9%,,35%,,2
Which of the following is acetylating agent?,,Chemistry,Organic Chemistry,Reagents,1,Medium,Sodium acetate,,Acetic acid,,Acetic anhydride,,Acetaldehyde,,3
Intoxication of polar solvent for using in laboratory is done by,,Chemistry,Organic Chemistry,Solvents,1,Easy,Ethanol,,Methanol,,Acetone,,None,,2
"In green house effect, methane causes",,Chemistry,Environmental Chemistry,Greenhouse effect,1,Easy,Absorption of heat,,Reflection of heat,,Destroy green house,,None,,1
The fibrous dye formed by oxidation is,,Chemistry,Organic Chemistry,Dyes,1,Medium,Mordant dye,,Vat dye,,Disperse dye,,Azo-dye,,2
"CH₃CH₂CH₂OH →(conc. H₂SO₄, alc. KOH) X →(Br₂) Y. Identify Z in the chemical reaction.",,Chemistry,Organic Chemistry,Alcohols & alkenes,1,Hard,CH₃CH(NH₂)CH(NH₂),,CH₃CHOHCH₃,,CH₃CH(OH)CH(OH),,CH₂=CH₂,,4
Which of the following is the correct molecular representation?,,Chemistry,Inorganic Chemistry,Chemical formulas,1,Easy,Mg₃(NO₃)₂,,Mg(NO₃)₂,,Mg₂(NO₃)₂,,MgNO₃,,2
Glucose on fermentation gives,,Chemistry,Biochemistry,Fermentation,1,Easy,Ethanol + CO₂,,Ethanol + H₂O + CO₂,,H₂O,,CO₂,,1
Which of the following reaction with aq. KOH to give alcohol and alkaline KOH to give alkene?,,Chemistry,Organic Chemistry,Alcohol reactions,1,Medium,Alkane,,Alkyl halide,,Alcohol,,Acid,,2
Magnetic quantum number specifies,,Chemistry,Atomic Structure,Quantum numbers,1,Medium,Size of an orbital,,Shape of orbital,,Orientation of orbitals in space,,Both shape and orientation,,3
The factor which doesn’t influence the rate of reaction is,,Chemistry,Chemical Kinetics,Rate of reaction,1,Medium,Nature of reactants,,Concentration,,Temperature,,Molecularity,,4
The indicator having pH range 8.2 to 10 is,,Chemistry,Acid-Base,Indicators,1,Easy,Methylene blue,,Phenolphthalein,,Methyl orange,,Methyl red,,2
Atoms having same atomic no. but different mass number are called,,Chemistry,Atomic Structure,Isotopes,1,Easy,Isotopes,,Isobars,,Isosteres,,Isomers,,2
