question_text,question_image_url,course_name,chapter,Topic,marks,difficulty,option_1,option_1_image_url,option_2,option_2_image_url,option_3,option_3_image_url,option_4,option_4_image_url,answer_option_number
Darwin's theory does not take account into,,Zoology,Evolution,Darwinism,1,Easy,Variation,,Natural selection,,Interspecific and intraspecific interaction,,Mutation,,3
Study of ageing,,Zoology,Gerontology,Ageing,1,Easy,Gerontology,,Anthropology,,Malacology,,Paleontology,,1
All stages in the life history of malarial parasite are haploid except,,Zoology,Parasitology,Malaria,1,Medium,Gametocyte,,Ookinete,,Schizont,,Sporozoite,,3
In frog 'Bidder's canals' are found in the:,,Zoology,Amphibia,Reproduction,1,Easy,Testes,,Kidney,,Ovary,,Pancreas,,2
Pseudopodia is commonly found in,,Zoology,Protozoa,Locomotion,1,Easy,Amoeba only,,Variety of protozoan’s,,Protozoans and leucocytes,,Amoeba and leucocytes,,3
"The absorption of glycerol, fatty acids and monoglycerides takes place by the",,Zoology,Digestive System,Absorption,1,Medium,Colon,,Capillaries within the villi,,Lymph-vessels within the villi,,Wall of the Stomach,,3
Dengue fever is a vector disease. Dengue is commonly caused by,,Zoology,Virology,Dengue,1,Easy,Aedes aegypti,,Flavivirus,,Rhinovirus,,Rotavirus,,1
Larva respires by:,,Zoology,Development,Respiration,1,Medium,Gills,,Pairs of spiracles,,Air fluid,,General body surface,,4
Animals in which nitrogen is predominantly excreted in the form of urea are,,Zoology,Excretion,Nitrogen Excretion,1,Medium,Ammonotelic,,Ureotelic,,Uricotelic,,None of the above,,2
"Motile, elongated zygote of Plasmodium is called as",,Zoology,Parasitology,Malaria,1,Medium,Gut of mosquito,,RBC of human,,Liver of human,,Salivary glands of mosquito,,4
Miller’s experiment provided the evidence for theory of,,Zoology,Evolution,Abiogenesis,1,Medium,Special creation,,Biogenesis,,Abiogenesis,,Organic evolution,,3
Organ of Bojanus in Mollusca is,,Zoology,Invertebrates,Mollusca,1,Medium,Respiratory organ,,Digestive organ,,Excretory organ,,Reproductive organ,,3
The cranial capacity of modern man is,,Zoology,Human Evolution,Cranial Capacity,1,Easy,200–400 cc,,700–900 cc,,1200–1400 cc,,500–700 cc,,3
Respiration in lichens takes place by,,Botany,Lichens,Respiration,1,Easy,Cephalium,,Isidium,,Soredia,,Cyphella,,3
Transfer of genetic information from a molecule of DNA into mRNA is known as,,Botany,Genetics,Transcription,1,Easy,Transcription,,Translation,,Replication,,Transduction,,1
Phospholipid bilayer is present in,,Botany,Cell Biology,Membrane Structure,1,Easy,Neuron,,Muscles,,Cell membrane,,Blood,,3
Scientific name of rice is,,Botany,Plant Taxonomy,Rice,1,Easy,Oryza sativa,,Triticum vulgare,,Zea mays,,Azadirachta indica,,1
Which one of the following enzyme is secreted by yeast for fermentation?,,Botany,Enzymes,Fermentation,1,Easy,Enolase,,Invertase,,Zymase,,Dehydrogenase,,3
Protonema is the stage in the life cycle of,,Botany,Bryophyta,Protonema,1,Easy,Marchantia,,Dryopteris,,Riccia,,Polytrichum,,4
The unique character of floral parts which acts as a barrier to avoid self pollination and favors cross pollination is:,,Botany,Reproduction,Flowers,1,Medium,Heterostyly,,Dichogamy,,Prepotency,,Herkogamy,,4
The viral infection cycle that will cause the viral DNA to become integrated into the bacterial DNA is called the,,Botany,Virology,Viral Cycle,1,Medium,Lysogenic cycle,,Lysozyme cycle,,Lytic cycle,,Lysel cycle,,1
The secretory product of soil fungus green moulds is called:,,Botany,Microbiology,Fungi,1,Easy,Penicillin,,Sulphonamides,,Tranquillizers,,Antiseptics,,1
In Amphicribal vascular bundle,,Botany,Plant Anatomy,Vascular Bundle,1,Medium,Open phloem is surrounded by open xylem,,Closed xylem is surrounded by phloem,,Open phloem is surrounded by xylem,,Closed phloem is surrounded by closed xylem,,3
Scientific name of Yarsagumba is,,Botany,Medicinal Plants,Yarsagumba,1,Medium,Hibiscus rosa sinensis,,Cordyceps sinensis,,Atropa belladonna,,Algae marmelos,,2
Phylloclade is modified part of,,Botany,Morphology,Modification,1,Easy,Stem,,Leaf,,Root,,Flower,,1
In prokaryotes the total number of ATP produced in aerobic respiration is,,Botany,Metabolism,Respiration,1,Medium,36,,2,,38,,34,,3
Entry of pollen tube through micropyle is,,Botany,Reproduction,Pollination,1,Easy,Mesogamy,,Basigamy,,Dichogamy,,Porogamy,,4
Vascular cryptogams is,,Botany,Cryptogams,Pteridophyta,1,Easy,Pteridophyta,,Bryophyta,,Algae,,Fungi,,1
The most commonly used green manure in our country is,,Botany,Agriculture,Green Manure,1,Easy,Trifolium,,Sesbania,,Oryza sativa,,Pisum sativum,,2
Red data book is,,Botany,Conservation,Red Data Book,1,Easy,Wild life conservation,,Endangered plants and animals,,Plants conservation only,,Animal conservation only,,2
Flow of energy in ecosystem,,Botany,Ecology,Ecosystem,1,Easy,Unidirectional,,Bidirectional,,Multidirectional,,Polydirectional,,1
Correct sequence of cell cycle is,,Botany,Cell Biology,Cell Cycle,1,Medium,S → G1 → M,,S → M → G1 → G2,,G1 → S → G2 → M,,M → G1 → S,,3
High annual productivity,,Botany,Ecology,Productivity,1,Easy,Tropical rain forest,,Tropical deciduous,,Temperate forest,,Temperate deciduous,,1
ATP is formed inside mitochondria in,,Botany,Metabolism,ATP Formation,1,Medium,Cristae,,Oxysome,,Matrix,,Inner membrane,,2
The growth curve of bacterial population in lab is plotted against time. What will be the shape of graph?,,Botany,Microbiology,Growth Curve,1,Medium,Sigmoid,,Hyperbolic,,Ascending straight line,,Descending straight line,,1
Ebola is caused by a,,Botany,Virology,Ebola,1,Easy,Virus,,Bacterium,,Protozoan,,Helminth,,1
Which of the following step is not involved in substrate level phosphorylation?,,Botany,Biochemistry,Respiration,1,Hard,Dihydroxyacetone phosphate → Glyceraldehyde 3 phosphate,,"1,3-diphosphoglycerate → 3-phosphoglycerate",,Succinyl CoA → Succinate,,Phosphoenol pyruvate → pyruvate,,1
A method for transferring DNA on a nitrocellulose membrane on which it can suitable probe is called,,Botany,Genetics,DNA Techniques,1,Medium,Northern blotting,,Southern blotting,,DNA sequencing,,RNA editing,,2
VNTRs in the DNA molecules are highly useful in,,Botany,Genetics,DNA Fingerprinting,1,Medium,DNA fingerprinting,,Genetic engineering,,Hybridoma technology,,Autoradiography,,1
Sacred groves play a significant role in,,Botany,Ecology,Conservation,1,Medium,Creating environmental awareness in communities,,Preventing soil erosion,,Conserving rare and threatened species,,Maintaining year round flow of water in rivers,,3
Azolla contains,,Botany,Symbiosis,Azolla,1,Easy,Rhizobium,,Mycorrhiza,,Cyanobacteria,,Humus,,3
____ causes wheat rust.,,Botany,Plant Pathology,Wheat Rust,1,Medium,Periplaneta americana,,Apis indica,,Puccinia graminis,,Drosera indica,,3
Waste burning to generate power illustrates,,Botany,Ecology,Energy,1,Easy,Bioremediation,,Bioconversion,,Biodegradation,,Biomanipulation,,2
Coir is the commercial product obtained from,,Botany,Economic Botany,Coir,1,Easy,Coccus nucifera,,Triticum aestivum,,Juglans regia,,Pisum sativum,,1
Which of the following are mainly responsible for atmospheric green house effect in the earth atmosphere?,,Botany,Ecology,Greenhouse Effect,1,Medium,Nitrogen and carbon dioxide,,Nitrogen and oxygen,,Ozone and oxygen,,Carbon dioxide and water vapour,,4
80S ribosome has subunits,,Botany,Cell Biology,Ribosomes,1,Easy,40S and 60S,,50S and 30S,,50S and 40S,,40S and 40S,,1
"Cork, cork cambium, secondary cortex are respectively called",,Botany,Plant Anatomy,Secondary Growth,1,Medium,"Phellem, Phellogen, Phelloderm",,"Phellogen, Phellem, Phelloderm",,"Phelloderm, Phellogen, Phellem",,"Phellem, Phellogen, Periderm",,1
Which of the following absorb light energy for photosynthesis?,,Botany,Photosynthesis,Pigments,1,Easy,ATP,,Chlorophyll,,NADPH2,,RuBP,,2
The step of mitosis in which chromosomes line up along the equatorial plane of the cells,,Botany,Cell Division,Mitosis,1,Easy,Prophase,,Metaphase,,Anaphase,,Telophase,,2
The original source of variation in a genome is,,Botany,Genetics,Mutation,1,Medium,Independent assortment,,Recombination,,Crossing over,,Mutation,,4
An example of alleles is,,Botany,Genetics,Alleles,1,Easy,AB and Tt,,TT and Tt,,T and t,,X and Y,,3
"If you know that the base-sequence of one strand is AATTCG, the sequence of the complementary strand must be",,Botany,Genetics,DNA,1,Easy,AATTCG,,TTGAC,,TTAAGC,,TTAAGC,,3
"Y, P, I, L ?",,MAT,Series,Alphabet Series,1,Medium,A,,B,,C,,D,,3
Compass : Direction :: Galvanometer : ?,,MAT,Analogy,Reasoning,1,Medium,Electricity,,Current,,Charge,,Power,,2
314 × 10^6 = ?,,MAT,Arithmetic,Numbers,1,Easy,3140,,314000,,3140000,,31400000,,1
Netra walks 48 km towards east and turn right and again walk 64 km. Now how far is Netra from starting point and in which direction?,,MAT,Directions,Distance & Direction,1,Hard,North-East 80 km,,North-West 80 km,,South-East 80 km,,South-West 80 km,,1
"Cost price of 20 articles is the same as the selling price of X articles. If the profit is 25%, then the value of x is:",,MAT,Arithmetic,Profit & Loss,1,Medium,16,,18,,25,,15,,2
"In the series 5, 10, 15, 20 … what will be 25th term?",,MAT,Series,Number Series,1,Easy,120,,125,,130,,135,,2
Give the correct water image of given word? BATALA,,MAT,Reasoning,Mirror & Water Image,1,Medium,BATALA,,AJATAB,,ATATAJ,,BVLIVTV,,2
"If GO = 32, SHE = 49 then, SOME will be equal to",,MAT,Coding-Decoding,Logic,1,Medium,58,,62,,64,,56,,2
Which of the following is wrong about Alkali metal?,,Chemistry,Periodic Table,Alkali Metals,1,Medium,Low melting point,,High ionization energy,,Low boiling point,,Ionic character,,2
Which has highest knocking property?,,Chemistry,Organic Chemistry,Hydrocarbons,1,Medium,Aromatic hydrocarbons,,Branched chain olefins,,Heterocyclic compounds,,Straight chain olefins,,2
Which of the following contains dipole induced dipole interactions?,,Chemistry,States of Matter,Intermolecular Forces,1,Medium,SiF4 and He,,HCl and He,,Cl2 and CCl4,,H2O and C2H5OH,,3
The movement of dispersion medium under the influence of electric field is called?,,Chemistry,Colloids,Electrokinetic Phenomena,1,Medium,Electrophoresis,,Electro osmosis,,Cataphoresis,,Polythene,,2
Which of the following forms nylon?,,Chemistry,Polymers,Synthetic Polymers,1,Easy,Polyster,,Polyamide,,Poly vinyl chloride,,Polythene,,2
Which of the following occurs when an electron in an excited state moves to ground state?,,Chemistry,Atomic Structure,Excited States,1,Medium,Atom undergoes spontaneous decay,,Energy is absorbed,,Light is emitted,,Charge increases,,3
Dehydration is most easiest in case of?,,Chemistry,Alcohols,Reactions of Alcohols,1,Medium,Tertiary alcohol,,Secondary alcohol,,Primary alcohol,,CH3OH,,1
Covalent character of transition metals increases with,,Chemistry,Transition Elements,Properties,1,Medium,Decrease in ionization energy,,Increase in oxidation state,,Decrease in oxidation state,,Increase in ionization energy,,2
IUPAC name of CH3-O-CH2-CH2-O-CH3 is,,Chemistry,Organic Chemistry,Nomenclature,1,Medium,Dimethoxy ether,,2-methoxy-3-oxy butane,,2-keto butanoic acid,,Dimethoxy ethane,,4
A liquid is found to scatter a beam of light but leaves no residue in a filter paper. The liquid can be described as,,Chemistry,Colloids,Tyndall Effect,1,Medium,True solution,,Oil,,Suspension,,Colloid,,4
Chlorine bleaches by,,Chemistry,Halogens,Properties,1,Easy,Oxidation,,Reduction,,Dehydration,,All,,1
The third law of thermodynamics helps in finding:,,Chemistry,Thermodynamics,Third Law,1,Medium,Enthalpy,,Absolute entropy,,Internal energy,,Free energy,,2
Which of the following is reducing agent in the following redox reaction? 14H+ + Cr2O7^-2 + Ni → Cr+3 + H2O + Ni+2,,Chemistry,Redox Reactions,Identifying Agents,1,Medium,H2O,,H+,,Ni,,Cr2O7,,3
A substance follows zero order kinetics if the rate constant is R and the initial concentration is a then the half life will be,,Chemistry,Chemical Kinetics,Zero Order Reaction,1,Hard,a/2k,,a/2R,,k/2,,1/ak,,1
When H2SO4 reacts with NaCl then H2SO4 acts as,,Chemistry,Acids and Bases,Reactions,1,Medium,Acid only,,Acid as well as oxidizing agent,,Acid as well as reducing agent,,Oxidizing agent only,,2
Which of the following element has lowest ionization energy?,,Chemistry,Periodic Table,Ionization Energy,1,Easy,Li,,K,,Na,,Cs,,4
A gas gets decolourises by alkaline KMnO4 solution but does not give precipitate with ammoniacal AgNO3 solution?,,Chemistry,Organic Chemistry,Hydrocarbons,1,Medium,Acetylene,,Ethylene,,Methane,,Ethane,,2
An ideal gas cannot be liquefied because,,Chemistry,Thermodynamics,Gaseous State,1,Medium,Critical temperature is low,,Intermolecular space is high,,Intermolecular forces are negligible,,Molecules are relatively smaller,,3
The compound formed as result of oxidation of ethyl benzene by KMnO4 is,,Chemistry,Organic Chemistry,Oxidation Reactions,1,Medium,Acetophenone,,Benzyl alcohol,,Benzophenone,,Benzoic acid,,4
Iodoethane reacts with alc. KCN followed by complete hydrolysis gives,,Chemistry,Organic Chemistry,Reaction of Alkyl Halides,1,Medium,Ethylamine,,Ethanamine,,Acetonitrile acid,,Propanoic acid,,4
Which of the following has highest ionization energy?,,Chemistry,Atomic Structure,Ionization Energy,1,Medium,"1s2, 2s2, 2p6, 3s2, 3p3",,"1s2, 2s2, 2p6, 3s2, 3p4",,"1s2, 2s2, 2p6, 3s2, 3p5",,"1s2, 2s2, 2p6, 3s2, 3p6",,3
The solubility of Ca3(PO4)2 in water is x moles/litre. Its solubility product is,,Chemistry,Equilibrium,Solubility Product,1,Hard,108 x^5,,64 x^5,,36 x^5,,6 x^5,,1
How many isomeric ether can be formed from C4H10O?,,Chemistry,Organic Chemistry,Isomerism,1,Medium,2,,4,,3,,5,,2
10 mole of ideal gas at 27°C undergoes isothermal expansion resulting in doubled volume. The work done by the gas (R=1.98 cal),,Chemistry,Thermodynamics,Isothermal Expansion,1,Hard,4.13 × 10^3,,4.13 × 10^5,,4.13 × 10^-3,,413 × 10^3 cal,,1
"In contact process, the arsenic impurity is removed by",,Chemistry,Industrial Chemistry,Contact Process,1,Medium,Pt,,V2O5,,Fe(OH)3,,FeO,,3
"The end product X is CH3COOH + NH3 → A (heat, P2O5) → B",,Chemistry,Organic Chemistry,Functional Group Transformation,1,Hard,Ethanamide,,Acid anhydride,,Acetonitrile,,Ethyl amine,,3
An electric current of 0.25 ampere was passed through acidified water for 2 hours. What will be the volume of H2 produced at NTP? (1 coulomb of electricity produce 10^-5 gm of water),,Chemistry,Electrochemistry,Faraday’s Laws,1,Hard,0.108 l,,0.408 l,,0.216 l,,0.36 l,,2
Which of the following intermediate is formed on chlorination of isobutene in presence of peroxide?,,Chemistry,Organic Chemistry,Free Radical Mechanism,1,Medium,Tert-butyl free radical,,Tert-butyl carbocation,,Tert-butyl carbanion,,Carbene,,1
"A toothpaste has 0.20g/l fluoride, its concentration in ppm is",,Chemistry,Environmental Chemistry,Fluoride,1,Medium,150,,250,,180,,400,,2
"During the estimation of halogens, sodium extract is first boiled with nitric acid so as to",,Chemistry,Qualitative Analysis,Sodium Extract,1,Medium,Increase the solubility of AgNO3,,Make silver halides insoluble,,Decompose NaCN and Na2S,,Dissolve AgCN,,3
Which of the following allotropes of phosphorus show phosphorescence?,,Chemistry,Periodic Table,Allotropes,1,Easy,White phosphorus,,Black phosphorus,,Red phosphorus,,Green phosphorus,,1
The change in optical rotation of freshly prepared solution of sugar is known as,,Chemistry,Organic Chemistry,Isomerism,1,Medium,Specific rotation,,Inversion,,Rotatory motion,,Mutarotation,,4
20 volume of solution of H2O2 means,,Chemistry,Redox Reactions,Hydrogen Peroxide,1,Medium,1 ml of solution liberates 20 ml of O2 at STP,,20 gm of H2O2 solution liberates 20 ml O2 at STP,,20 gm equivalent of H2O2 liberates 20 ml O2 at STP,,20 litres of H2O2 solution liberates 20 ml O2 at STP,,1
What is the main reason why it is difficult to form nitrogen compounds from gaseous nitrogen?,,Chemistry,Inorganic,Nitrogen properties,1,Medium,All reactions of N₂ are endothermic,,The bond dissociation energy of N₂ is very high,,The first ionization energy of the nitrogen atom is very high,,The triple bond in nitrogen is three times as strong as an N–N bond,,2
In the blast furnace maximum temperature is in:,,Chemistry,Metallurgy,Blast furnace,1,Medium,Zone of fusion,,Zone of combustion,,Zone of slag formation,,Zone of reduction,,2
Which halogenoalkane will undergo an SN1 reaction and produce a yellow precipitate when AgNO₃(aq) is added to it?,,Chemistry,Organic,Reaction mechanism,1,Hard,1-chlorobutane,,1-iodobutane,,2-chloro-2-methylpropane,,2-iodo-2-methylpropane,,4
"To distinguish among primary, secondary, and tertiary alcohols, one would use the following experimental method?",,Chemistry,Organic,Alcohols,1,Medium,Sandmeyer reaction,,Wittig reaction,,Lucas test,,Tollens reagent,,3
Diethyl ether is decomposed on heating with:,,Chemistry,Organic,Ethers,1,Easy,NaOH,,Water,,KMnO₄,,H₂,,3
An organic compound J reacts with sodium to produce an organic ion with a charge of –3. J reacts with NaOH(aq) to produce an organic ion with a charge of –1. What could be the structural formula of J?,,Chemistry,Organic,Organic compounds,1,Hard,HO₂CCH(OH)CH₂CO₂H,,HO₂CCH(OH)CH₂CHO,,HOCH₂CH(OH)CH₂CO₂H,,HOCH₂CO₂H,,1
Charring of sugar is due to:,,Chemistry,Organic,Carbohydrates,1,Easy,Oxidation,,Reduction,,Dehydration,,Reduction and hydration,,3
The amino acid which does not show optical isomerism is:,,Chemistry,Biochemistry,Amino acids,1,Medium,Lysine,,Glycine,,Alanine,,Cystine,,2
"When HNO₃ is dropped on the palm and washed with water, the palm turns yellow. It shows the presence of:",,Chemistry,Inorganic,Nitrogen oxides,1,Medium,NO₂,,N₂O,,NO,,N₂O₃,,1
"A sample of ethyl propionate is hydrolysed by heating under reflux with aqueous sodium hydroxide. The two organic products of the hydrolysis are separated, purified and weighed. Out of the total mass of products obtained, what is the percentage by mass of each product?",,Chemistry,Organic,Esters,1,Hard,32.4% and 67.6%,,38.3% and 61.7%,,42.3% and 57.7%,,50.0% and 50.0%,,3
Which functional group cannot be turned into an alcohol in a single reaction?,,Chemistry,Organic,Functional groups,1,Medium,Alkene,,Carbonyl,,Halogenoalkane,,Nitrile,,4
"In a famous experiment, the German chemist Wohler heated an inorganic salt and produced urea, CO(NH₂)₂, as the only product. The heating of the original inorganic salt, on heating with aqueous NaOH, produced a gas which turned damp red litmus paper blue. What is the formula of the anion in the original inorganic salt?",,Chemistry,Organic,History of chemistry,1,Medium,CN⁻,,CN,,CO₃²⁻,,NH₂⁻,,1
"When NH₄Cl salt is dissolved in water, then resulting solution becomes:",,Chemistry,Inorganic,Ammonium salts,1,Easy,Acidic,,Basic,,Neutral,,None,,1
In which process are hydrogen bonds broken?,,Chemistry,Physical Chemistry,Intermolecular forces,1,Medium,H₂(l) → H₂(g),,NH₃(l) → NH₃(g),,2HI(g) → H₂(g) + I₂(g),,CH₄(g) → C(s) + 4H(g),,2
The change in enthalpy (ΔH) of a system is equal to the heat flow between the system and its surroundings (q) under which condition?,,Chemistry,Thermodynamics,Enthalpy,1,Medium,Constant volume,,Constant pressure,,Constant temperature,,Adiabatic condition,,2
"In the reaction between Al₂O₃ and NaOH, Al₂O₃ acts as",,Chemistry,Inorganic,Amphoteric oxides,1,Medium,Acid,,Base,,Neutral,,None,,2
In which reaction does an element undergo the largest change in oxidation state?,,Chemistry,Redox,Oxidation states,1,Hard,Cl₂ + 2OH⁻ → ClO⁻ + Cl⁻ + H₂O,,3Cl₂ + 6OH⁻ → ClO₃⁻ + 5Cl⁻ + 3H₂O,,Cr₂O₇²⁻ + 6Fe²⁺ + 14H⁺ → 2Cr³⁺ + 6Fe³⁺ + 7H₂O,,3MnO₂ + 4H⁺ → MnO₄⁻ + 2Mn²⁺ + 2H₂O,,3
Two waves each of loudness 'L' superimpose to produce beats. The maximum loudness of the beats will be:,,Physics,Waves,Beats,1,Medium,L,,4L,,2L,,6L,,2
The magnification of an astronomical telescope is 5. The power of its eye-piece is +10D. What is the power of its objective lens?,,Physics,Optics,Telescope,1,Medium,#ERROR!,,#ERROR!,,#ERROR!,,#ERROR!,,3
A simple pendulum has time period T₁ when on earth’s surface and T₂ when taken to a height R above the earth’s surface (where R is the radius of the earth) then the value of T₂/T₁ is:,,Physics,Mechanics,Gravitation,1,Hard,4,,2,,√2,,1,,3
X ray is produced at 50KV. The minimum wavelength of X ray emitted is:,,Physics,Modern Physics,X-rays,1,Medium,0.25 Å,,2.5 Å,,5 Å,,0.54 Å,,2
The correct sequence of electromagnetic wave in decreasing order of frequency:,,Physics,Waves,Electromagnetic spectrum,1,Medium,"X-ray, visible ray, microwave",,"Infra-red, visible ray, UV-ray",,"X-ray, visible ray, UV-ray",,"Microwave, UV-ray, X-ray",,3
"If 1500 cal of heat is supplied to a system and 1000J of work is done, what is increase in internal energy?",,Physics,Thermodynamics,First law of thermodynamics,1,Medium,2000 J,,5000 J,,4300 J,,6000 J,,3
"A cylinder contains 150cc of ideal gas at 27°C and 650 mm pressure. On constant pressure, the volume of gas at 0°C is:",,Physics,Gas Laws,Charles law,1,Medium,130cc,,136.5cc,,140cc,,150cc,,2
"Two tuning fork A and B sounded together to produce 5 beats. The frequency of B 512 Hz. When fork A is filed and sounded together, the beat frequency increases. The frequency of A is:",,Physics,Waves,Beats,1,Medium,502 Hz,,507 Hz,,517 Hz,,517.7 Hz,,3
"In electromagnetic wave, orientation of electric and magnetic waves is:",,Physics,Waves,Electromagnetic waves,1,Easy,0°,,90°,,180°,,None,,2
The resultant of two force 3P and 2P is R. If the first force is doubled then the resultant is also doubled. The angle between the two forces is:,,Physics,Mechanics,Vectors,1,Hard,45°,,60°,,90°,,120°,,3
The velocity of light in a gas of refractive index 1.5 is 2 × 10⁸ m/s. The velocity of light in liquid is 2.5 × 10⁸ m/s. The refractive index of the liquid is:,,Physics,Optics,Refraction,1,Medium,1.44,,1.2,,0.64,,0.8,,1
Work done in capacitor of capacitance C and charge Q is W. If the charge is doubled then what is new work done?,,Physics,Electricity,Capacitors,1,Medium,2W,,8W,,4W,,6W,,2
2 grams of copper is deposited in a voltameter in 30 minutes at 12 volt. What mass is deposited at 6 volt and time for 45 minutes?,,Physics,Electricity,Faraday’s law,1,Hard,0.5 gm,,1.5 gm,,4 gm,,3 gm,,2
In a projectile thrown at the same angles the velocity of A is two times of velocity of B their ranges are related as,,Physics,Mechanics,Projectile motion,1,Medium,Rₐ = 2Rᵦ,,Rₐ = 4Rᵦ,,Rᵦ = 2Rₐ,,Rᵦ = 4Rₐ,,2
A body of mass 200 gm is thrown upwards with initial velocity of 30 m/s. what is total energy of body at height of 20 m from ground?,,Physics,Mechanics,"Work, Power, Energy",1,Medium,50 J,,100 J,,40 J,,90 J,,2
A faulty thermometer with lower fixed point 5°C and upper fixed point 95°C respectively. What is correct temperature when the reading gives 35°C?,,Physics,Thermometry,Temperature scales,1,Medium,60°C,,40°C,,33.3°C,,25°C,,3
Particle nature of light is shown by,,Physics,Optics,Nature of light,1,Easy,Photoelectric effect,,Velocity of light,,Diffraction,,Refraction,,1
A cylinder of 500 m³ capacity contains He at 27°C and at 1 atm pressure. If the temperature changes to –3°C and 0.5 atm the new volume of gas is,,Physics,Gas Laws,Combined gas law,1,Medium,500 m³,,900 m³,,400 m³,,150 m³,,2
"The power of combination of convex and concave lens is +4 D. If the power of convex lens is 4D, the focal length of concave lens is",,Physics,Optics,Lenses,1,Medium,100 cm,,–1 cm,,–0.4 cm,,–0.25 cm,,2
"The resistance of 20 cm length of wire is 5 ohms. When the wire is stretched to 40 cm length, the new resistance becomes",,Physics,Electricity,Resistance,1,Medium,10 ohm,,20 ohm,,40 ohm,,2.54 ohm,,2
Two waves are defined to be coherent if,,Physics,Waves,Interference,1,Medium,They are emitted by identical sources close together,,They have a constant phase difference between them,,They have the same amplitude and frequency,,They have the same wavelength and speed,,2
Which of the following correctly shows regions of the electromagnetic spectrum in order of increasing wavelength?,,Physics,Waves,EM spectrum,1,Medium,Gamma → infra-red → visible → radio,,Microwave → ultraviolet → visible → infra-red,,Radio → microwave → infra-red → visible,,Ultraviolet → visible → infra-red → microwave,,4
"In Young’s double slit experiment, 12 fringes are obtained in a certain fragment of the screen when light of wavelength 600 nm is used. If the wavelength of light is changed to 400 nm, number of fringes obtained in the same segment of the screen will be:",,Physics,Waves,Interference,1,Medium,12,,24,,18,,30,,3
A long solenoid is formed by winding 20 turns/cm. The current necessary to produce a magnetic field of 20 milli tesla inside the solenoid will be approximately:,,Physics,Magnetism,Solenoid,1,Medium,1.0 A,,2.0 A,,4.0 A,,8.0 A,,3
"In a purely resistive A.C. circuit, the current:",,Physics,Electricity,AC circuits,1,Easy,Lags behind the emf in phase,,Is in phase with emf,,Leads the emf in phase,,Leads the emf in half the cycle and lags behind it in the other half,,2
"A bulb is rated at 100V, 220W, when the voltage drops by 2%, then change in power of bulb is:",,Physics,Electricity,Power in AC circuits,1,Medium,Increased by 2%,,Increases by 4%,,Decreases by 2%,,Decreases by 4%,,4
If a thin metal foil is introduced between the plates of the capacitor. Then the capacitance,,Physics,Electricity,Capacitors,1,Medium,Increases,,Decreases,,Remains constant,,All,,4
The percentage of mass converted into energy in the nuclear fission reaction is,,Physics,Nuclear Physics,Nuclear fission,1,Medium,10%,,20%,,0.20%,,0.10%,,3
